1165,"Bank of Maharashtra tops PSU lenders chart in terms of loan, saving deposit growth in Q1","Aug 15, 2021"
1166,Finance Minister Nirmala Sitharaman to meet CEOs of public sector banks on August 25,"Aug 15, 2021"
1167,ICICI Home Finance launches on-the-spot home loan for workers having no ITR,"Aug 13, 2021"
1168,Visa could gain 5% incremental share as curbs on MasterCard continue,"Aug 13, 2021"
1169,RBI gives Ind Bank Housing time till December to complete revival process,"Aug 13, 2021"
1170,Central Bank of India identifies 350 branches in coastal areas for aqua financing,"Aug 13, 2021"
1171,"Senior citizens can withdraw money from SCSS, PPF etc. via authorized person: Here's how","Aug 13, 2021"
1172,Can banking be as easy as ordering food online? AI and blockchain may soon make it a reality,"Aug 12, 2021"
1173,RBI imposes Rs 1 cr penalty on Cooperatieve Rabobank U.A.,"Aug 12, 2021"
1174,"Bank credit grows 6.11% in fortnight ended July 30, shows RBI data","Aug 12, 2021"
1175,Airtel Payments Bank turns profitable in July amid business growth: CEO to staff,"Aug 12, 2021"
1176,Deutsche Bank gets nod to set up IFSC banking unit at GIFT City,"Aug 12, 2021"
1177,"Banks tap IPO investments, book listing gains","Aug 11, 2021"
1178,Indian Bank signs Memorandum of Understanding with Paralympic Committee,"Aug 11, 2021"
1179,Festive season to push credit demand: Au Small Finance Bank CEO,"Aug 11, 2021"
1180,"Yes Bank to float asset reconstruction company, invites bids from investors","Aug 11, 2021"
1181,KVB contributes Rs 10 lakh under CSR to hold free vaccination drive,"Aug 11, 2021"
1182,A new phishing attack lurking to scam banking customers: Advisory,"Aug 11, 2021"
1183,Global banks unwind lucrative India trades after RBI warning,"Aug 11, 2021"
1184,You can lose 48% of interest if you break your post office time deposit before maturity,"Aug 11, 2021"
1185,ATM installed in Meghalaya hospital where inventor was born in 1925,"Aug 10, 2021"
1186,RBI to impose penalties on banks for failing to ensure cash availability at ATMs,"Aug 10, 2021"
1187,Bharat ATM to add 20 lakh outlets by 2022-end to offer banking services to rural area,"Aug 10, 2021"
1188,Neeraj Chopra roped in for RBI awareness campaign,"Aug 10, 2021"
1189,"5 lenders including HDFC Bank, Kotak in race for Citi India’s retail business","Aug 10, 2021"
1190,India's richie rich will have to shell out more to be in the IPO league,"Aug 10, 2021"
1191,"HDFC Bank receives Rs 30,000 crore prepayments amid signs of economic recovery, deleveraging","Aug 9, 2021"
1192,"Banks report improved NII, lower NPA provisioning in Q1","Aug 9, 2021"
1193,"CASA ratio moved from 39% to nearly 40% over last 12 months: Sanjiv Chadha, Bank of Baroda","Aug 9, 2021"
1194,"Recovery will be sharper this time, but certain segments may lag: Nitin Chugh, Ujjivan SFB","Aug 9, 2021"
1195,Merger helps Bank of Baroda step up retail loans: CEO,"Aug 9, 2021"
1196,Fixed income has negative returns now: Why investing in bank FDs is a loser's game,"Aug 9, 2021"
1197,"10 rules of investing, saving right: Steps to follow, pitfalls to avoid","Aug 9, 2021"
1198,IDBI stake sale: 7 firms in transaction adviser shortlist,"Aug 8, 2021"
1199,RBI empanels Karnataka Bank as ‘agency bank’ for govt business,"Aug 8, 2021"
1200,IDBI Bank strategic sale: 7 firms in race for transaction advisor,"Aug 8, 2021"
1201,NCLT admits tea producer McLeod Russel for bankruptcy proceedings,"Aug 7, 2021"
1202,Yes Bank board okays prosecution of Rana Kapoor,"Aug 7, 2021"
1203,Stolen Indian card details in largest slice of database released on Dark Web by cybercriminals,"Aug 6, 2021"
1204,Indian Bank & IIMB's incubation arm sign up on exclusive credit to startups,"Aug 6, 2021"
1205,Timeline for IBC resolution needs to be shortened: Shaktikanta Das,"Aug 6, 2021"
1206,Rise in retail stress levels not alarming : RBI Deputy Governor Jain,"Aug 6, 2021"
1207,Bank fraud case: Delhi Crime Branch arrests 3 suspects for allegedly duping HDFC Bank of Rs 1.4 crore,"Aug 6, 2021"
1208,"Big rush to set up shop at GIFT city: Deutsche Bank, Citigroup, Zerodha among 24+ applicants","Aug 5, 2021"
1209,"Bank of Maharashtra waives processing fee on gold, home, car loans till September 30","Aug 5, 2021"
1210,"As loan growth slows, other income comes to banks' rescue","Aug 5, 2021"
1211,"A single account holder can withdraw a joint bank FD prematurely; here’s how it works, and should you go for it?","Aug 5, 2021"
1212,"SBI Q1 profit surges 55% to Rs 6,504 crore","Aug 5, 2021"
1213,SBI sees rising stress in home loan and MSME book in June quarter,"Aug 4, 2021"
1214,RBI extends deadline for current account notification,"Aug 4, 2021"
1215,SBI to take steps to insulate bank's balance sheets from stress in telecom firms: Dinesh Khara,"Aug 4, 2021"
1216,RBI cautions against fraudulent buy or sale of old banknotes,"Aug 4, 2021"
1217,The world could be about to wake up to the next big thing in banking,"Aug 4, 2021"
1218,Yes Bank fraud case: ED arrests Gautam Thapar of Avantha Group,"Aug 4, 2021"
1219,Home loan portfolios of many banks begin showing signs of stress,"Aug 4, 2021"
1220,Changes to insolvency law approved by Rajya Sabha,"Aug 3, 2021"
1221,RBI tightens rules for payment companies outsourcing core activities,"Aug 3, 2021"
1222,"NBFCs' NPAs to rise 1% in FY22, recast loans to double: Report","Aug 3, 2021"
1223,Bank of India Q1 results: Net profit falls 15% to Rs 720 crore,"Aug 3, 2021"
1224,IndusInd Bank gets empanelled as Agency Bank to RBI,"Aug 3, 2021"
1225,"Now get salary, pension credited on Sundays and bank holidays","Aug 3, 2021"
1226,HDFC Q1 results: Net profit falls but beats estimates,"Aug 3, 2021"
1227,RBL Bank reports Rs 459 crore loss in Q1 on higher loan provisions,"Aug 2, 2021"
1228,RBI imposes Rs 50.35 lakh penalty on Nashik-based Janalaxmi Co-operative Bank,"Aug 2, 2021"
1229,PM Modi launches e-RUPI: India’s new purpose-specific digital payment solution,"Aug 2, 2021"
1230,India is showing world it is not behind in adopting new technology: PM at the launch of e-RUPI,"Aug 2, 2021"
1231,e-RUPI: What is it? How does it work?,"Aug 2, 2021"
1232,India defers sale of state-run banks to next year,"Aug 2, 2021"
1233,"Credit growth to improve this year, aim to become universal bank: Equitas SFB","Aug 2, 2021"
1234,PM Modi launches e-RUPI: What is it and why is it being envisaged as an alternative to DBT?,"Aug 2, 2021"
1235,Bypassing rule: Banks’ use of FD-OD fix irks RBI,"Aug 2, 2021"
1236,PM Modi to launch digital payment solution e-RUPI today,"Aug 2, 2021"
1237,"Banks close lakhs of current accounts, clients open grievance accounts","Aug 1, 2021"
1238,PM Modi to launch e-RUPI today. Here's all about the cashless digital payment solution,"Aug 1, 2021"
1239,"RBI's new rules on interchange fee, 24/7 bulk clearing facility functional","Aug 1, 2021"
1240,"PSU banks mobilise record funds of Rs 58,700 crore from markets in FY'21","Aug 1, 2021"
1241,IDFC First Bank logs Rs 630-crore loss in Q1 on pandemic provisions,"Aug 1, 2021"
1242,IDFC First Bank logs Rs 630 crore loss in Q1 on Covid provisioning,"Jul 31, 2021"
1243,Fino Payments Bank files for Rs 1300 crore IPO,"Jul 31, 2021"
1244,SBI announces 100% waiver on home loan processing fee,"Jul 31, 2021"
1245,New IDBI owners may get RBI road map to cut stake,"Jul 31, 2021"
1246,"Banks’ jewellery, auto auctions to rise","Jul 31, 2021"
1247,Banks rope in global companies to guard against rising cyberattacks,"Jul 31, 2021"
1248,"Forcing minimum claim period of 1 year on bank guarantees wrong, says Delhi HC","Jul 30, 2021"
1249,"HDFC Bank gears up to ramp up corporate loans, and how!","Jul 30, 2021"
1250,"Turnaround is on, we'll have even better results in the coming quarters, says IDBI Bank CEO","Jul 30, 2021"
1251,"Union Bank of India Q1 results: Net profit zooms to Rs 1,181 cr","Jul 30, 2021"
1252,Customer-focus and digital-first are the keys to survival and growth: Uday Kotak,"Jul 29, 2021"
1253,"RBI cancels licence of Madgaum Urban Co-operative Bank Ltd, Margao","Jul 29, 2021"
1254,"IndusInd Bank will take provisions upfront rather than deferring: Sumant Kathpalia, MD & CEO","Jul 29, 2021"
1255,World Bank arm IFC holds nearly 5% stake in Federal Bank with Rs 916 crore capital infusion,"Jul 29, 2021"
1256,NPAs & Covid-19 implications temporary; Indian banking on path to revival: ETILC,"Jul 29, 2021"
1257,"We see growth coming back, but remaining cautious: Sumant Kathpalia, IndusInd Bank","Jul 29, 2021"
1258,"Maharashtra rains shut 1,200 ATMs in five districts, derail banking ops","Jul 29, 2021"
1259,Paytm Payments Bank crosses 1-crore FASTags mark,"Jul 28, 2021"
1260,"Yes Bank, Indiabulls Housing Finance to give home loans under co-lending model","Jul 28, 2021"
1261,RBI imposes Rs 5 crore penalty on Axis Bank,"Jul 28, 2021"
1262,Large govt capex a possible saving grace for economy in FY22: Yes Bank chairman Sunil Mehta,"Jul 28, 2021"
1263,ED attaches Rs 5-crore worth assets in Bengaluru Syndicate Bank branch fraud case,"Jul 28, 2021"
1264,"Over 50% of slippages from MSME sector: LV Prabhakar, Canara Bank","Jul 28, 2021"
1265,Fast growing gold loans turn sour hit by lockdowns,"Jul 28, 2021"
1266,"IndusInd Bank Q1 profit doubles, sets 16% credit growth target","Jul 27, 2021"
1267,Karnataka Bank Q1 results: Co reports net profit of Rs 106 Crore,"Jul 27, 2021"
1268,"SBI, Axis Bank, ICICI Bank, others buy stakes in fintech firm IBBIC","Jul 27, 2021"
1269,"Canara Bank restructures loans worth Rs 13,000 crore, MSME, retail worst hit","Jul 27, 2021"
1270,Covid impact: Retail loans impairment rises as borrowers delay payments,"Jul 27, 2021"
1271,"Nearly Rs 49,000 crore lying unclaimed with banks, insurers: Karad","Jul 27, 2021"
1272,UCO Bank Q1 results: Net profit jumps over 4-fold to Rs 102 cr,"Jul 27, 2021"
1273,"Canara Bank Q1 results: Net profit rises nearly three-fold to Rs 1,177 cr","Jul 27, 2021"
1274,Axis Bank buys 5.55 pc stake in financial technology firm IBBIC,"Jul 27, 2021"
1275,Escrow service provider Castler launches white label solution to ensure safe transactions,"Jul 27, 2021"
1276,"Kotak Bank net soars 32% in Q1 on higher income; bad loans rise, too","Jul 27, 2021"
1277,"Axis Bank Q1 results: Net profit rises 94% YoY, misses estimate; NII rises 11%","Jul 26, 2021"
1278,Bank NPAs decline to Rs 8.34 lakh cr at March-end 2021: Minister,"Jul 26, 2021"
1279,"Consumer spends will come back strongly in coming days: Rama Mohan Rao Amara, SBI Card","Jul 26, 2021"
1280,Mastercard ban: RBI seeks action plan from banks,"Jul 26, 2021"
1281,JP Morgan India CEO sees infrastructure building as the biggest opportunity for India,"Jul 25, 2021"
1282,HDFC Bank's Puri top earner among bankers in FY21; ICICI Bank's Bakhshi forgoes salary in COVID year,"Jul 25, 2021"
1283,"ICICI Bank Q1 results: Net profit rises 78% to Rs 4,616 cr as provisions fall","Jul 24, 2021"
1284,Yes Bank Q1 profit quadruples as NPA additions slow,"Jul 23, 2021"
1285,"Indian Bank declares Lanco Infra, Basundhara Green Power as fraud a/cs with Rs 589 crore exposure","Jul 23, 2021"
1286,"India Post Payments Bank doubles transactions, plans digital inroads with India Post","Jul 23, 2021"
1287,RBI allows loans up to Rs 5 crore to other banks' directors without board approval,"Jul 23, 2021"
1288,"5 years of IBC: Insolvency law has helped improve recoveries, but delays disappoint","Jul 23, 2021"
1289,Citi rainmaker Rahul Saraf becomes its new I-Banking head,"Jul 22, 2021"
1290,"Prem Watsa-backed CSB Bank's profit jumps 14%, but gold loan NPAs spike","Jul 22, 2021"
1291,‘Mastercard’s dual record maintenance led to RBI ban’,"Jul 22, 2021"
1292,"U GRO Capital launches Pratham, a MSME co-lending program with Bank of Baroda","Jul 21, 2021"
1293,Indel Money in talks with PE players to divest 15 percent for Rs 140 crore,"Jul 20, 2021"
1294,What if you wanted to know how much Mukesh Ambani has in his account?,"Jul 20, 2021"
1295,Inside BharatPe-Centrum proposed JV to acquire troubled PMC Bank,"Jul 20, 2021"
1296,Banks dig deep to verify client claims about Covid impact,"Jul 20, 2021"
1297,Private banks take a knock on asset worries,"Jul 19, 2021"
1298,HDFC Bank creates new segment to work for both India and Bharat: Chairman,"Jul 19, 2021"
1299,MSME loans risky even as banks transmitted rate cuts the most,"Jul 19, 2021"
1300,"Indian Bank expects profit to sustain at this level, MSME asset quality falters","Jul 19, 2021"
1301,Paytm Payment Gateway enables payment from fixed deposit account held with partner IndusInd Bank,"Jul 19, 2021"
1302,"Goldman Sachs expands back-office ops with Hyderabad office, to hire 560 staff in 2021","Jul 19, 2021"
1303,Government to first gauge investor response to IDBI stake sale,"Jul 19, 2021"
1304,RBI’s Mastercard ban may hit Citibank India’s retail business sale,"Jul 19, 2021"
1305,"NPCI in talks to take UPI, RuPay to global markets","Jul 18, 2021"
1306,Several factors still hinder monetary transmission to bank rates: RBI,"Jul 18, 2021"
1307,"IBA to soon move application to RBI for setting up Rs 6,000-cr bad bank","Jul 18, 2021"
1308,"Complied with 85% of asks on tech, ball in RBI court for lifting ban: HDFC Bank","Jul 17, 2021"
1309,HDB Financial sees bad loans double in a quarter,"Jul 17, 2021"
1310,Failover mechanism protects us from MasterCard ban: HDFC Bank MD Sashidhar Jagdishan,"Jul 17, 2021"
1311,Will bounce back strongly after pandemic behind us: HDFC Bank MD,"Jul 17, 2021"
1312,Second wave impact: HDFC Bank’s NBFC arm sees bad loans double in three months,"Jul 17, 2021"
1313,"HDFC Bank Q1 results: Profit rises 16.1% to Rs 7,730 crore, misses Street estimates","Jul 17, 2021"
1314,"Central Bank of India to seek shareholders' nod to set off accumulated loss of Rs 18,724 cr","Jul 17, 2021"
1315,"Reduction in NPAs for PSBs due to write-offs at Rs 1,31,894 cr in FY21: RTI","Jul 17, 2021"
1316,Recovery Officer Debt Recovery Tribunal sells Rs 716-cr shares in United Spirits,"Jul 16, 2021"
1317,SBI working towards launching Yono 2: Chairman,"Jul 16, 2021"
1318,Banks consortium gets over Rs 792 crore in Mallya loan default case: Enforcement Directorate,"Jul 16, 2021"
1319,Fresh card issuance by 5 private banks to be impacted due to ban on Mastercard by RBI: Report,"Jul 16, 2021"
1320,SBI-led consortium raises Rs 792 crore by sale of Vijay Mallya’s UB shares,"Jul 16, 2021"
1321,SBI is proxy to the Indian economy: Dinesh Khara,"Jul 16, 2021"
1322,ET Financial Inclusion Summit: Banks and fintech startups can't do without each other,"Jul 16, 2021"
1323,ET Financial Inclusion Summit: Taking digital banking to rural India,"Jul 16, 2021"
1324,Bank privatisation move an exciting opportunity for investors: Former RBI DG,"Jul 15, 2021"
1325,Bank credit grows by 6.08%; deposits by 9.76%,"Jul 15, 2021"
1326,Bandhan Bank faces asset quality test with sharp fall in repayment collection,"Jul 15, 2021"
1327,Physical bank branches will continue to play key role in rural areas: Bankers,"Jul 15, 2021"
1328,"Securitisation deals return in June, but activity still at half of pre-pandemic levels: Report","Jul 15, 2021"
1329,MFI sector's credit cost seen at 5-10 pc in FY22: Report,"Jul 15, 2021"
1330,Pensioners may now get pension slip from banks through WhatsApp also,"Jul 15, 2021"
1331,"India's ban on Mastercard to hit banks' card operations, income: Sources","Jul 15, 2021"
1332,Decoded: How RBI's latest ban on Mastercard affects you,"Jul 15, 2021"
1333,RBL Bank's credit card issuance rate to be impacted post RBI's Mastercard ban,"Jul 15, 2021"
1334,Standard Chartered Bank pulled up for selling ED-attached London property,"Jul 15, 2021"
1335,"No senior-level resignations, says Axis Bank","Jul 14, 2021"
1336,PNB moves court seeking restoration of assets of Nirav Modi's firms confiscated by ED,"Jul 14, 2021"
1337,Banks get time till March 2022 to implement lockable cassettes swap system for ATMs,"Jul 14, 2021"
1338,"RBI cancels licence of Dr Shivajirao Patil Nilangekar Urban Co-op Bank, Latur","Jul 14, 2021"
1339,"Bandhan Bank rejigs portfolio, hires new retail and commercial banking head","Jul 14, 2021"
1340,Chanda Kochhar matter: SAT asks Sebi's Adjudicating Officer not to proceed till Sept 15,"Jul 14, 2021"
1341,"IL&FS expects to recover Rs 58,000 crore by March next year","Jul 14, 2021"
1342,‘Opening no-frill bank a/cs first step towards financial inclusion’,"Jul 13, 2021"
1343,Finance Ministry puts examination for clerical cadre in PSU banks on hold,"Jul 13, 2021"
1344,"DBS looks to Lakshmi Vilas Bank customers to widen deposit, lending base","Jul 13, 2021"
1345,Lenders set up bad bank for loans in default,"Jul 13, 2021"
1346,RBI allows merger of holding Cos with small finance banks,"Jul 12, 2021"
1347,Supreme Court verdict: Banks explore option of invoking personal guarantee of promotion,"Jul 12, 2021"
1348,PNB Scam: Court grants bail to the MD of three of the accused firms,"Jul 12, 2021"
1349,Failure rate in debit transactions could mean economy not out of woods yet,"Jul 12, 2021"
1350,Given approval to set up small finance bank to take over PMC Bank: RBI to HC,"Jul 12, 2021"
1351,RBI's nod to SFBs and holding companies merger can unlock value for Ujjivan,"Jul 12, 2021"
1352,Non-bank lenders may take a bigger hit in Q1 on second wave,"Jul 12, 2021"
1353,"Govt extends deadline for transaction, legal advisors to bid for managing IDBI Bank sale till July 22","Jul 11, 2021"
1354,Federal Bank shareholders approve re-appointment of Shyam Srinivasan as MD & CEO,"Jul 10, 2021"
1355,Transaction advisors for IDBI Bank stake sale can submit bids till July 22,"Jul 9, 2021"
1356,Federal Bank gets RBI nod to re-appoint Shyam Srinivasan as MD & CEO for 3 yrs,"Jul 9, 2021"
1357,Bank employees posted in sensitive positions to get surprise leave every year,"Jul 9, 2021"
1358,Bankers working in sensitive positions to get surprise leaves of at least 10 days,"Jul 9, 2021"
1359,India’s risk-averse lenders are emerging as one of the biggest hurdles to its recovery,"Jul 9, 2021"
1360,"Lower growth, loan slippages likely to cloud banks’ June quarter","Jul 9, 2021"
1361,RBI warns banks of LIBOR preparedness,"Jul 8, 2021"
1362,HDFC Bank's CSR spends grow 18 per cent to Rs 635 crore in FY21,"Jul 8, 2021"
1363,"Punjab National Bank, Home Finance arm at odds over Sebi order regarding Carlyle deal","Jul 8, 2021"
1364,RBI penalises 14 banks for non-adherence to rules on lending to NBFCs,"Jul 7, 2021"
1365,Indian banks improved performance due to delay in stress recognition: Fitch,"Jul 7, 2021"
1366,Asset quality numbers do not reflect stress on bank books: ICRA,"Jul 7, 2021"
1367,RBI warns of stress build-up in consumer credit,"Jul 6, 2021"
1368,Bajaj Finance's headline numbers for the June quarter show muted disbursements and lower customer acquisition,"Jul 6, 2021"
1369,"Razorpay, Mastercard launch solution for recurring payments; aims to integrate with over 50 banks","Jul 6, 2021"
1370,NHB imposes Rs 4.75 lakh fine on HDFC for technical non-compliance,"Jul 6, 2021"
1371,"HDFC Bank not immune to Covid, loan growth hit","Jul 5, 2021"
1372,"Yes Bank's loans, advances shrink marginally at Rs 1.63 lakh cr by end of June quarter","Jul 5, 2021"
1373,HDFC Bank loans rise over 14% to Rs 11.47 lakh crore in June,"Jul 5, 2021"
1374,"Industrial sector's share in bank credit falls sharply as corporates deleverage, seek out new fund sources","Jul 4, 2021"
1375,Airtel Payments Bank hopeful of break-even in FY22; logs surge in business volumes amid pandemic,"Jul 4, 2021"
1376,Bank credit grows 5.82%; deposits by 10.32%,"Jul 2, 2021"
1377,RBI imposes Rs 25 lakh on Punjab and Sind Bank,"Jul 2, 2021"
1378,ED attaches assets of son-in-law of Ahmed Patel in Sandesaras case,"Jul 2, 2021"
1379,RBI warns against allowing Big Tech firms into financial services,"Jul 2, 2021"
1380,"Beating pandemic: IIFL to hire 5,000 people, open 700 branches in FY22","Jul 1, 2021"
1381,Banks better placed to handle shocks than six months ago: RBI,"Jul 1, 2021"
1382,Banks' gross NPAs may rise to 9.8% by March 2022: RBI report,"Jul 1, 2021"
1383,"Despite recast, significant stress seen among MSMEs - RBI","Jul 1, 2021"
1384,Indian banks better placed to withstand future shocks: Report,"Jul 1, 2021"
1385,"The economy is going to come back on track very quickly: Keki Mistry, VC & CEO, HDFC","Jul 1, 2021"
1386,HDFC Bank has road map for a big comeback in credit cards,"Jul 1, 2021"
1387,"Personal loan offtake rose in FY21, industrial loans contracts","Jun 30, 2021"
1388,HDFC Bank counts on cross selling to make up for lost market share in credit card business,"Jun 30, 2021"
1389,"Indian banks face systemic risk, second COVID wave to impair performance: S&P","Jun 30, 2021"
1390,RBI ban on new credit cards sale hit market share; will come back with a bang once embargo lifted: HDFC Bank,"Jun 30, 2021"
1391,"Amid demand revival worries, Axis Bank sees 10 times growth in online shopping fest","Jun 30, 2021"
1392,RBI sets July 30 deadline for banks to move current accounts,"Jun 30, 2021"
1393,HC orders notice to SEBI on plea against DHFL,"Jun 29, 2021"
1394,RBI imposes penalties on 4 cooperative banks,"Jun 29, 2021"
1395,Transforming Communication Key For Banks & Insurers,"Jun 29, 2021"
1396,90% of first ECLGS amount disbursed so far: Report,"Jun 29, 2021"
1397,Cabinet may soon clear proposal for govt guarantee to bad bank,"Jun 29, 2021"
1398,SBI to levy charges for cash withdrawal beyond four free transactions per month,"Jun 29, 2021"
1399,Co-op banks shall not outsource core management functions: RBI,"Jun 28, 2021"
1400,"Asset quality concerns remain, bad bank to lessen the burden, says BCG","Jun 28, 2021"
1401,Indian economy poised for recovery in FY22: SBI Chairman Dinesh Kumar Khara,"Jun 27, 2021"
1402,RBI hunts for entity that can develop multimedia publicity material for awareness campaign,"Jun 27, 2021"
1403,Cabinet secretary-led panel holds crucial meeting on bank privatisation,"Jun 27, 2021"
1404,"In Covid year, banks see record profit of Rs 1 lakh crore","Jun 26, 2021"
1405,"In Covid year, banking sector sees record profit of Rs 1 lakh crore","Jun 26, 2021"
1406,HDFC Bank ups lending to state-run entities,"Jun 26, 2021"
1407,"RBI prescribes qualifications for MDs, WTDs of urban cooperative banks","Jun 25, 2021"
1408,"SBI-led consortium gets over Rs 5,800 crore in Mallya loan default case: ED","Jun 25, 2021"
1409,RBI extends curbs on the operations at PMC Bank,"Jun 25, 2021"
1410,Indian economy will be impacted due to the second wave of Covid 19: SBI chairman Dinesh Kumar Khara,"Jun 25, 2021"
1411,RBI extends restrictions on PMC Bank till December 31,"Jun 25, 2021"
1412,SBI launches Aarogyam healthcare business loan,"Jun 24, 2021"
1413,"India's bank credit-to-GDP ratio inches up to 56% in 2020, but still way behind peers: BIS data","Jun 24, 2021"
1414,"Indian Bank focuses on fee income, cost reduction to boost bottom line","Jun 24, 2021"
1415,"Loan default case: CBI conducts searches in Mumbai, Delhi against Avantha Group promoter Gautam Thapar","Jun 24, 2021"
1416,"Smaller banks get cold feet, deactivate cryptocurrency accounts","Jun 24, 2021"
1417,RBI penalises three Maharashtra-based co-operative banks,"Jun 24, 2021"
1418,PNB board meeting on Friday; PNB Housing Finance issue may come up,"Jun 23, 2021"
1419,"Banks getting ready for rise in credit demand, raising capital","Jun 23, 2021"
1420,"Central bank digital currencies can offer finality, liquidity, integrity: BIS","Jun 23, 2021"
1421,NBFCs’ vehicle loan and MFI collections hit most by Covid 2.0,"Jun 23, 2021"
1422,Bandhan Bank gets branding rights of Salt Lake Sector V Metro station,"Jun 23, 2021"
1423,Have redoubled efforts to fix tech loopholes: HDFC Bank CEO,"Jun 23, 2021"
1424,"Federal Bank donates 10,000 Covid vaccine carriers to Kerala","Jun 23, 2021"
1425,Gang steals Rs 48 lakh from SBI cash deposit machines; lender puts withdrawal on hold,"Jun 22, 2021"
1426,"Things will only look up from here, both for economy and SBI: Ashwani Bhatia, MD, SBI","Jun 22, 2021"
1427,Covid 2.0 may bring a recast surge at NBFCs,"Jun 22, 2021"
1428,"Do lower rates hurt savers? Not quite, says RBI research","Jun 22, 2021"
1429,Fixed deposit returns may not rise in near future,"Jun 21, 2021"
1430,PNB Housing Finance appeals against Sebi order,"Jun 21, 2021"
1431,"Visa plans to enter cross-border corp payment segment, seeks RBI nod","Jun 21, 2021"
1432,"Visa plans to enter cross-border corp payment segment, seeks RBI nod","Jun 21, 2021"
1433,Authum promoters’ past lapses emerge with Rel Home win,"Jun 20, 2021"
1434,PMC Bank depositors should get back deposits without any condition: NCUI,"Jun 20, 2021"
1435,"Here's how Centrum, BharatPe propose to merge PMC Bank","Jun 20, 2021"
1436,"Here's how Centrum, BharatPe propose to merge PMC Bank","Jun 20, 2021"
1437,"Centrum-Bharatpe joint venture to pump Rs 1,800 crore into PMC on merger","Jun 20, 2021"
1438,Bank of Maharashtra tops PSU bank chart in MSME loan growth in FY21,"Jun 20, 2021"
1439,"Karnataka Bank declares loan over Rs 160 crore to Reliance Home, Reliance Commercial as fraud","Jun 19, 2021"
1440,BharatPe CEO assures PMC Bank depositors as Centrum-BharatPe get in-principle approval from RBI,"Jun 19, 2021"
1441,"It’s a bank, PMC will be part of, it’s not takeover, says Centrum's Jaspal Bindra","Jun 19, 2021"
1442,"RBI allows Centrum to set up small finance bank, paves way for takeover of fraud hit PMC Bank","Jun 18, 2021"
1443,IDBI Bank invites bids to divest stake in Asset Reconstruction Company,"Jun 18, 2021"
1444,RBI grants in-principle approval to Centrum to own PMC Bank via SFB route,"Jun 18, 2021"
1445,YES Bank removes fraud tag on Avantha Holdings after forensic audit,"Jun 18, 2021"
1446,Banks may drop overseeing panel for quicker resolution,"Jun 18, 2021"
1447,MFI portfolio rose 8.4 per cent in FY'21: Report,"Jun 17, 2021"
1448,"BharatPe FY21 revenue jumps over six times to Rs 700 crore, targets to double it in FY22","Jun 17, 2021"
