1736,"Second wave of COVID infections poses increased risks for fragile economic recovery, banks: Fitch","Apr 9, 2021"
1737,Top Indian bank drags its feet on billionaire Gautam Adani's coal loan,"Apr 9, 2021"
1738,"Pay scale for bank CGMs made almost equal to EDs, executives say its against natural justice","Apr 8, 2021"
1739,Covid 2.0 casts a cloud of uncertainty on banks' Q4 numbers,"Apr 8, 2021"
1740,"We've always been a banker for the 'aam aadmi', says City Union Bank CEO Dr N Kamakodi","Apr 8, 2021"
1741,"We're prepared for whatever happens, says City Union Bank CEO Dr N Kamakodi, of a second coronavirus wave","Apr 8, 2021"
1742,Even NBFCs face asset quality risks amidst resurgence of COVID-19 infections,"Apr 8, 2021"
1743,View: Policies that increase competition between banks can improve the lending standards of PSBs,"Apr 7, 2021"
1744,RBI status quo on policy supportive of economic growth; liquidity measures in right direction: Experts,"Apr 7, 2021"
1745,TLTRO finds few takers even as RBI extends deadline,"Apr 7, 2021"
1746,Decoding RBI's new digital payments moves and their impact on fintech ecosystem,"Apr 7, 2021"
1747,Banks sanction Rs 15 lakh crore under Mudra Yojana in last 6 years,"Apr 7, 2021"
1748,RBL Bank targets more SME borrowers after tie-up with UK-based biz solutions provider Tide,"Apr 6, 2021"
1749,Axis Bank to become co-promoter of Max Life Insurance,"Apr 6, 2021"
1750,"Steel, cement doing very well from banking perspective: Rajkiran Rai G, Union Bank of India","Apr 6, 2021"
1751,Banks want free vaccine shots for staff,"Apr 6, 2021"
1752,PSU Banks fully transmit rate cuts on fresh loans,"Apr 5, 2021"
1753,Investment banking fees plunge 34 pc in Q1 to USD 194.5 mn: Report,"Apr 5, 2021"
1754,RBI withdraws restrictions on Youth Development Co-operative Bank,"Apr 5, 2021"
1755,J.P. Morgan ties up with BillDesk for online payments partnership,"Apr 5, 2021"
1756,Banks report modest growth in advances and deposits in the last quarter of FY 2020-21,"Apr 5, 2021"
1757,Latest round of Covid restrictions has lenders fretting over rising defaults,"Apr 5, 2021"
1758,Gross NPAs of banks may rise to 9.6-9.7% by March-end: Report,"Apr 5, 2021"
1759,"Federal Bank gross advances up by 9% at Rs 1.35 lakh crore by March 2021, deposits up 13%","Apr 5, 2021"
1760,ICRA warns of significant jump in bad loans in current fiscal year,"Apr 5, 2021"
1761,"HDFC Bank advances up 14 percent, deposits rise 16 percent at the end of March 2021","Apr 5, 2021"
1762,Yes Bank loans and advances up 0.8% at Rs 1.73 lakh crore by end of Mar 2021; deposits up 55%,"Apr 5, 2021"
1763,CA firms sue RBI after getting replaced as auditors of Allahabad Bank,"Apr 5, 2021"
1764,"Banks sanctions Rs 25,586 cr to 1.14 lakh Stand-Up India accounts in 5 years","Apr 4, 2021"
1765,"Year-end pressure hits fund transfers via IMPS, UPI in millions","Apr 4, 2021"
1766,"SBI Card sees over 50 percent of its transaction from online payments, says CEO","Apr 4, 2021"
1767,SCDCC bank achieves record profit of Rs 33.65 crore,"Apr 4, 2021"
1768,"India's public banks may have to take Rs 2,000 crore hit after SC order on interest waiver","Apr 4, 2021"
1769,Covid-19 surge derails banks’ plans to get back to HQs,"Apr 3, 2021"
1770,"PSU banks go slow on asset sales, await privatisation list","Apr 3, 2021"
1771,Karnataka Bank targets over Rs 1.42 lakh cr business turnover in FY22; says digital the way forward,"Apr 2, 2021"
1772,"PNB plans to hire non-judicial member to scrutinise proposals on compromise, write off","Apr 2, 2021"
1773,RBI may continue its curbs on HDFC Bank following technical glitches,"Apr 2, 2021"
1774,HDFC increases FD rates up to 25 bps,"Apr 1, 2021"
1775,"India Inc's credit quality improves sharply in H2FY21, likely to sustain","Apr 1, 2021"
1776,"Yes Bank loan fraud: ED files charge sheet against Mumbai realty firm owners, others","Apr 1, 2021"
1777,State Bank of India customers face network glitches for online transactions,"Apr 1, 2021"
1778,Loans to mid-size Indian firms up most in a decade on cash surge,"Apr 1, 2021"
1779,"Bank credit to grow 10% in FY22 on faster GDP expansion, policy measures: Crisil","Apr 1, 2021"
1780,"ICICI Bank, PhonePe tie up for issuance of FASTags","Apr 1, 2021"
1781,HDFC Ltd increases rates on fixed deposits maturing between 33 and 99 months by 10-25 basis,"Mar 31, 2021"
1782,India to inject $2 billion capital in four weakened state banks,"Mar 31, 2021"
1783,"SBI signs loan agreement of $1 billion with JBIC, taking total facility to $2 billion","Mar 31, 2021"
1784,Automatic recurring payment to comply with RBI direction from April 1,"Mar 30, 2021"
1785,Rising Covid cases could derail financial sector recovery,"Mar 30, 2021"
1786,Punjab & Sind Bank declares loans worth Rs 150 cr to IL&FS Transportation as fraud,"Mar 30, 2021"
1787,HDFC Bank faces intermittent glitches with payments platform,"Mar 30, 2021"
1788,Loan moratorium: Lenders want compensation for interest loss,"Mar 30, 2021"
1789,Piramal may sell developer loans of DHFL after deal,"Mar 30, 2021"
1790,Government not inclined to bear loan moratorium costs,"Mar 28, 2021"
1791,Banks to conduct special clearing operations for closure of government accounts on March 31,"Mar 28, 2021"
1792,Govt unlikely to continue with zero-coupon bond route to recap PSU banks,"Mar 28, 2021"
1793,RBI says engaged with prospective investors to secure best terms for PMC Bank depositors,"Mar 26, 2021"
1794,Punjab & Sind Bank declares IL&FS account as fraud with Rs 399 crore outstanding,"Mar 25, 2021"
1795,Bank of Maharashtra add six more branches,"Mar 25, 2021"
1796,India will have heterogeneous banking sector in a decade with four types of banks: Shaktikanta Das,"Mar 25, 2021"
1797,Parliament passes bill to set up National Bank for Financing Infrastructure and Development,"Mar 25, 2021"
1798,Ensuring health of banking sector top priority: Shaktikanta Das at India Economic Conclave 2021,"Mar 25, 2021"
1799,"View: Good mandate, unintended repercussions","Mar 25, 2021"
1800,Mumbai: PMC account holders stage protest in Bhandup,"Mar 25, 2021"
1801,"""Be humble and honest above all else,"" HDFC Bank boss pens a letter to employees","Mar 25, 2021"
1802,Tata Sons readying ‘universal’ payments solution,"Mar 25, 2021"
1803,SC verdict on compound interest/penalty refund not to impact banks as govt to reimburse: Yes Securities,"Mar 24, 2021"
1804,Former RBI deputy governor Khan not seeking re-appointment on Bandhan Bank board,"Mar 24, 2021"
1805,NBFCs want govt to refund interest on deposits,"Mar 24, 2021"
1806,"Sebi orders attachment of bank, demat, MF accounts of Rana Kapoor","Mar 24, 2021"
1807,ICICI Bank enables customers to break high-value transactions into EMIs,"Mar 24, 2021"
1808,Privatising two PSBs: India Ratings warns of rating impact if govt cedes control,"Mar 24, 2021"
1809,Govt may seek details of interest on interest charged by banks,"Mar 24, 2021"
1810,Can Fin Homes' CEO has aggressive growth plans for next couple of years,"Mar 24, 2021"
1811,Removal of bad debt ‘hangover’ hands Indian banks clarity,"Mar 24, 2021"
1812,Bad loans likely to jump by Rs 1.3 lakh crore,"Mar 23, 2021"
1813,Bankers welcome SC order but brace for hit on reversal of interest,"Mar 23, 2021"
1814,Banks' NPAs declined to Rs 5.70 lakh crore at December-end: Anurag Singh Thakur,"Mar 23, 2021"
1815,DK Mittal has two suggestions for RBI to improve banking sector,"Mar 23, 2021"
1816,"Sense has prevailed, moratorium is a commercial decision that banks should take: Uday Kotak","Mar 23, 2021"
1817,Supreme Court pronounces verdict on plea seeking extension of loan moratorium,"Mar 23, 2021"
1818,"SC order a big relief, removes uncertainties: Bankers","Mar 23, 2021"
1819,"Interest waiver not possible, can't allow extension of loan moratorium period, says SC","Mar 23, 2021"
1820,"No compound or penal interest be charged from borrowers during moratorium period, directs SC","Mar 23, 2021"
1821,SBI invokes personal guarantees given by KSK Energy promoters,"Mar 23, 2021"
1822,Business activities gradually improving but it could still be a while before MFI segment sees a turnaround,"Mar 22, 2021"
1823,"After reaching pre-Covid levels, we will now focus on surpassing industry growth: SBI Cards Boss","Mar 22, 2021"
1824,"Post exit from PCA framework, IDBI Bank to focus on improving efficiency ratios, says MD","Mar 21, 2021"
1825,View: The issues with RBI's plan to set up 'NUE' entity for retail payments,"Mar 20, 2021"
1826,Bandhan Bank inducts two new members on its board,"Mar 19, 2021"
1827,Gold loan offtake slows in Q4 as price comes down,"Mar 19, 2021"
1828,Our digital transactions have gone as high as 67% now: SBI Chairman,"Mar 19, 2021"
1829,Federal Bank plans to buy microfinance company to expand business,"Mar 19, 2021"
1830,Banks may go slow on gold loans,"Mar 18, 2021"
1831,Big opportunity for investing in India’s private credit market: Experts,"Mar 18, 2021"
1832,HDFC Bank leads peer lenders over mobile transactions despite tech glitches,"Mar 17, 2021"
1833,See business normalisation in 90 days: HDFC Bank retail head,"Mar 17, 2021"
1834,NPAs expected to increase in first half of 2021: FICCI-IBA survey,"Mar 17, 2021"
1835,We had a vision that we will be a world class Indian bank: Aditya Puri,"Mar 17, 2021"
1836,"Infra, farm reforms put India on $5-trillion track: Aditya Puri, former chief executive of HDFC Bank","Mar 17, 2021"
1837,"SBI, Paytm Payments Bank, PhonePe lead in UPI transactions in Feb","Mar 16, 2021"
1838,Reserve Bank imposes Rs 2 cr penalty on SBI,"Mar 16, 2021"
1839,"IFSCA allows banks in IFSCs to undertake portfolio management, investment advisory services","Mar 16, 2021"
1840,Bank union strike severely disrupts banking services across the country,"Mar 16, 2021"
1841,Bank of Baroda bets on new digital platform to expand retail lending,"Mar 16, 2021"
1842,"Performance of unsecured loans worsening, says India Ratings","Mar 16, 2021"
1843,Permission for new pvt banks to participate in govt biz will be based on RBI guidelines: FM,"Mar 16, 2021"
1844,"According to a December 2020 RBI survey, banks witnessed high demand for individual loans","Mar 16, 2021"
1845,Banking services in Maharashtra impacted on second day of nationwide strike,"Mar 16, 2021"
1846,Bank employees continue nationwide strike for 2nd consecutive day,"Mar 16, 2021"
1847,Bank strike Day 2: Services that are likely to be disrupted today,"Mar 16, 2021"
1848,"HDFC is seen not just as a mortgage company but as a financial conglomerate: Keki Mistry, CEO, HDFC","Mar 16, 2021"
1849,"CRR-SLR relief a must to look at HDFC-HDFC bank merger: Keki Mistry, CEO, HDFC","Mar 16, 2021"
1850,RBI asks banks to implement image-based Cheque Truncation System in all branches by September 30,"Mar 15, 2021"
1851,Banking services impacted across Maharashtra on first day of strike,"Mar 15, 2021"
1852,Services of PSBs hit in Bengal as bank unions go on strike to protest against privatisation,"Mar 15, 2021"
1853,"India’s banks are on strike, here’s all the services affected today and tomorrow","Mar 15, 2021"
1854,"Banking services in Maharashtra hit as 40,000 bank employees, officers join two-day strike","Mar 15, 2021"
1855,Bank Privatisation: PSB employees on a two-day nationwide strike against the proposed measure,"Mar 15, 2021"
1856,Nationwide strike impacts banking services of PSU banks on day one,"Mar 15, 2021"
1857,Perpetual bond issue may hit PSB fundraising plans,"Mar 15, 2021"
1858,Bank lending 50 per cent higher in October-February,"Mar 14, 2021"
1859,"Bank operations may be hit on Monday, Tuesday due to nationwide unions' strike","Mar 14, 2021"
1860,Bank lending 50 per cent higher in October-February,"Mar 14, 2021"
1861,Community-focused banks face existential crises over a lack of capital cushion and inadequate oversight,"Mar 13, 2021"
1862,Indian banks' loans rose 6.6% y/y in two weeks to Feb 26: Central Bank,"Mar 12, 2021"
1863,Ishraq Ali Khan takes charge as UCO Bank's executive director,"Mar 12, 2021"
1864,"HDFC Bank to cover vaccination cost of employees, family members","Mar 12, 2021"
1865,"FinMin to infuse Rs 14,500 cr in banks under RBI's prompt corrective action framework soon","Mar 12, 2021"
1866,Indian Overseas Bank gets new executive director,"Mar 12, 2021"
1867,Videocon ex-promoter Venugopal Dhoot granted bail in ICICI Bank-Chanda Kochhar case,"Mar 12, 2021"
1868,India’s bank employees are striking on March 15 and 16. Here’s what we know,"Mar 12, 2021"
1869,"To capitalise on India, you must be entrenched, says Piyush Gupta of DBS Bank","Mar 12, 2021"
1870,RBI is exploring ways to regulate online loan apps,"Mar 12, 2021"
1871,SBI to conduct e-auctions of 12 bad accounts this month,"Mar 11, 2021"
1872,Banks unions call for two-day strike against proposed privatisation of PSBs,"Mar 11, 2021"
1873,"MNCs are prepaying rupee borrowings and sourcing money from their home bases: Taranjit Jaswal, Barclays Bank India","Mar 11, 2021"
1874,"HSBC banks on NRI, wealth management in fresh retail charge","Mar 11, 2021"
1875,"Cholamandalam, Karur Vysya Bank come together for co-lending business","Mar 11, 2021"
1876,Executives get longer stint at top deck of PSU banks,"Mar 11, 2021"
1877,Cyber security critical for digital banking success: SBI official,"Mar 10, 2021"
1878,Axis Bank launches contactless wearable payment devices,"Mar 10, 2021"
1879,Uco Bank gets a new executive director after a year,"Mar 10, 2021"
1880,Erstwhile Syndicate Bank cheque books valid till June-end,"Mar 10, 2021"
1881,RBI removes PCA restrictions on IDBI Bank,"Mar 10, 2021"
1882,"SC sets up committee, seeks report on steps to be taken for early disposal of cheque bounce cases","Mar 10, 2021"
1883,ICICI Bank to bear cost of COVID-19 vaccination for employees,"Mar 10, 2021"
1884,"KKR-led group weighs Rs 1,100 crore out-of-court offer from Sintex promoters","Mar 10, 2021"
1885,Banks sanction Rs 2.46 lakh cr to 92 lakh borrowers under credit guarantee scheme to MSMEs,"Mar 9, 2021"
1886,"Lenders cut exposure to lower rated developers, improve credit profile","Mar 9, 2021"
1887,Banks write-off Rs 1.15 lakh crore in 9 months of FY21: Anurag Singh Thakur,"Mar 8, 2021"
1888,Bombay HC directs Williamson Magor to deposit Rs 15 crore in the court in a suit filed by Kotak Bank,"Mar 8, 2021"
1889,Kotak Mahindra Bank says glitch in its accounts due to wrong claims by a PSU bank,"Mar 8, 2021"
1890,Yes Bank launches 'Yes Essence' services for women,"Mar 8, 2021"
1891,"BBB to select MD, DMDs of proposed development financial institution","Mar 8, 2021"
1892,More than 50% account holders under PMJDY women: FinMin,"Mar 8, 2021"
1893,Economic impact of COVID-19 to weigh on asset quality of banks in FY'22: Fitch,"Mar 8, 2021"
1894,Fraudulent loans cannot be sold to bad bank: RBI,"Mar 8, 2021"
1895,Citigroup needs a new strategy for its lagging Asian consumer banks,"Mar 8, 2021"
1896,"Central banks in no rush to raise rates, will back growth: Shaktikanta Das","Mar 8, 2021"
1897,Large Indian lenders seek time on standing instructions,"Mar 8, 2021"
1898,"Data sharing, cybersecurity top concern areas for banks, customers: Deloitte","Mar 7, 2021"
1899,"Flushed with liquidity, banks slash home loan rates to decadal low","Mar 7, 2021"
1900,Kotak Mahindra Bank appoints agricultural economist Ashok Gulati as additional director,"Mar 5, 2021"
1901,Kotak Mahindra Bank divests 10 per cent stake in ECA Trading Services to its arm,"Mar 5, 2021"
1902,Banks may seek extension of freeze on NCLT proceedings,"Mar 5, 2021"
1903,"Bad bank is a great initiative but can turn into an accounting gimmick unless foreign investors are brought in: K Balasubramanian, Citibank India","Mar 5, 2021"
1904,Indian Bank reports 3 NPA accounts as fraud to RBI,"Mar 5, 2021"
1905,ICICI Bank targeting to serve 20 lakh customers of rival banks through app,"Mar 4, 2021"
1906,Kotak Mahindra Bank to handle salary account of Indian army personnel,"Mar 4, 2021"
1907,"ICICI, HDFC, SBI will have to offload Rs 1.2 lakh cr if RBI caps stake in insurance arms: Report","Mar 4, 2021"
1908,More women borrowed personal loans in pandemic: Report,"Mar 4, 2021"
1909,Bank of Baroda petitions Delhi HC to vacate stay on Reliance Home asset sale,"Mar 4, 2021"
1910,India Ratings flags systemic risk issues on banking exposure to NBFCs,"Mar 4, 2021"
1911,J&K govt withdraws nomination of Zubair Iqbal as MD of J&K Bank,"Mar 4, 2021"
1912,Indian state-run banks likely to see moderate bad loan additions: Morgan Stanley,"Mar 4, 2021"
1913,Banking services may get affected later this month due to proposed strike: Canara Bank,"Mar 4, 2021"
1914,"NBFCs push for parity with banks, seek access to credit repository of large borrowers","Mar 3, 2021"
1915,"HDFC follows SBI, Kotak, cuts home loan rate","Mar 3, 2021"
1916,Axis Bank partners WhatsApp to offer basic banking services,"Mar 3, 2021"
1917,Ujjivan Small Finance Bank's micro loan collection in Assam suffers following loan waiver promise,"Mar 3, 2021"
1918,SBI Card customers can now make transactions on Jio Pay platform,"Mar 3, 2021"
1919,"Extreme weather like floods, droughts, cyclones puts $84 billion of Indian banks debt at risk","Mar 3, 2021"
1920,RBI raises concerns over money-laundering checks,"Mar 3, 2021"
1921,Capital infusion: Punjab & Sind Bank to convene EGM this month to seek shareholders' nod,"Mar 2, 2021"
1922,RBI restricting banks from raising stakes in insurance firms - sources,"Mar 2, 2021"
1923,SBI led webinar on Indian budget evokes favourable response in Israel,"Mar 2, 2021"
1924,Kotak Mahindra Bank cuts home loan rates to 6.65%,"Mar 1, 2021"
1925,"Bank credit grows to 6.58 per cent, deposits at 11.75 per cent","Mar 1, 2021"
1926,"IDBI Bank to set off Rs 45,586-cr accumulated losses against balance in securities premium account","Mar 1, 2021"
1927,HDFC Bank faces intermittent downtime on Payments stack,"Mar 1, 2021"
1928,"State Bank of India (SBI) cuts home loan interest rates, offer ending on 31 March","Mar 1, 2021"
1929,Canara Bank's Executive Director Matam Venkata Rao appointed as new MD & CEO of Central Bank,"Mar 1, 2021"
1930,"Nine banks, two non-bank lenders to infuse Rs 7,000 crore in bad bank","Mar 1, 2021"
1931,View: How the government can truly make India's state-run banks efficient just like their private sector peers,"Feb 28, 2021"
1932,SBI eyes aircraft leasing business,"Feb 28, 2021"
1933,Axis Bank board approves reclassification of United India Insurance as public shareholder,"Feb 27, 2021"
1934,Banking sector was hurt in the name of aggressive lending a decade back: PM Modi,"Feb 26, 2021"
1935,IOB signs corporate agency pact with SBI General Insurance,"Feb 26, 2021"
1936,"For digital payments, the battle isn't for space but to get merchants online","Feb 26, 2021"
1937,"Regulating the financial sector - a challenge for the sector, but must for consumer confidence","Feb 26, 2021"
1938,Government committed to strengthen banking sector: PM Narendra Modi,"Feb 26, 2021"
1939,Wipro employees had a role in Citibank's big blunder that saw $900 million gone,"Feb 26, 2021"
1940,Bad bank will be a new ARC set up by PSBs: Shaktikanta Das,"Feb 26, 2021"
1941,"Upbeat on rural prospects, DCB Bank focuses on tractor loans","Feb 25, 2021"
1942,India has space for another strong ARC led by banks: Shaktikanta Das,"Feb 25, 2021"
1943,IBA starts identifying stressed loans for proposed bad bank,"Feb 25, 2021"
1944,Bank privatisation: How should India go about it?,"Feb 24, 2021"
1945,Fino Payments Bank says inclusion in commercial bank list to boost business prospects,"Feb 24, 2021"
1946,Bankers fear spike in NPAs from Mudra loans,"Feb 24, 2021"
1947,Improvement in macroeconomic conditions to alleviate banking sector stress: S&P,"Feb 24, 2021"
1948,"CSB Bank strengthens senior leadership, aims for 30% growth","Feb 23, 2021"
1949,Paytm Payments Bank helps 2.6 lakh FASTag users get back wrongly deducted toll charges,"Feb 23, 2021"
1950,HSBC's India PBT in 2020 inches up to $1.024 billion,"Feb 23, 2021"
1951,Federal Bank aims 'mid-teen' growth in credit for FY22,"Feb 23, 2021"
1952,All MPC members batted for accommodative policy stance,"Feb 23, 2021"
1953,SBI joins JPMorgan's blockchain-based payment network,"Feb 22, 2021"
1954,"10 months on, appointment of J&K Bank chief hangs in limbo","Feb 22, 2021"
1955,Stress in retail loans of banks may triple by FY22 end: Ind-Ra,"Feb 22, 2021"
1956,Transferring sticky loans: Fully provided NPAs may go to proposed bad bank,"Feb 22, 2021"
1957,Corporate lenders vs taxman: Round one of bankruptcy bout goes to the lenders,"Feb 20, 2021"
1958,"Deccan Urban Co-op Bank: RBI puts Rs 1,000 withdrawal cap for 6 months","Feb 20, 2021"
1959,Team of diverse investors puts in bid for embattled PMC Bank,"Feb 20, 2021"
1960,"RBI puts Rs 1,000 withdrawal cap on Deccan Urban Co-operative Bank; fresh loans, deposits restricted","Feb 19, 2021"
1961,Karnataka Bank reports Rs 34.16-crore fraud to RBI,"Feb 19, 2021"
1962,"LIC Housing Finance disburses Rs 1,331 crore of loans via mobile app","Feb 19, 2021"
1963,Bank unions stage protest against privatisation; plan to march towards Parliament in March,"Feb 19, 2021"
1964,"Indian Bank signs MOU with SID of IISc, for funding Start-ups and MSMEs","Feb 19, 2021"
1965,Govt flags SBI-HDFC Bank-Bank of Baroda's NUE plan to rival NPCI,"Feb 19, 2021"
1966,"RBI tightens payments security norms for banks, digital payment operators","Feb 18, 2021"
1967,Government's initiatives brings back loan growth to pre-Covid levels,"Feb 18, 2021"
1968,"As court rules Citi can't get back $500 mn it wrongly paid, what does India's law say","Feb 18, 2021"
1969,"KKR India NBFC, InCred set for all-stock merger","Feb 18, 2021"
1970,Public sector banks plan ‘daylight overdrafts’ to lure top companies from private rivals,"Feb 17, 2021"
1971,"RBI issues draft guidelines for CDS, derivative contracts","Feb 16, 2021"
1972,DFIs to play important role in infrastructure funding: HDFC Bank's Rakesh Singh,"Feb 16, 2021"
1973,RBI permits residents to make remittances to IFSCs under LRS,"Feb 16, 2021"
1974,Banks eye bigger home loan pie as housing finance companies face challenges,"Feb 16, 2021"
1975,Indian Bank integrates core banking software of erstwhile Allahabad Bank,"Feb 15, 2021"
1976,India shortlists four banks for potential privatisation: Sources,"Feb 15, 2021"
1977,Future of banking is a digital business model,"Feb 15, 2021"
1978,"RBI sets up panel to suggest steps for strengthening, consolidating urban co-operative banks","Feb 15, 2021"
1979,Kotak Mahindra Bank announces launch of Kotak Remit on mobile,"Feb 15, 2021"
1980,Top NBFCs seek a glide path for switch to banking avatar,"Feb 15, 2021"
1981,"Debt knell: With retail debt past Rs 40 lakh crore, worries about defaults on repayments rise","Feb 13, 2021"
1982,Former SBI chief Rajnish Kumar to be exclusive advisor for Kotak Group's USD 1 billion-stressed assets fund,"Feb 13, 2021"
1983,PMLA case: Former ICICI Bank CEO Chanda Kochhar gets bail,"Feb 12, 2021"
1984,"CREDAI, IPPB ink pact to open bank accounts for construction workers","Feb 12, 2021"
1985,PMLA case: Ex-ICICI Bank CEO Chanda Kochhar granted bail,"Feb 12, 2021"
1986,Some points to remember while sending money from one country to another,"Feb 12, 2021"
1987,Bank privatisation debate: Here's how the doyens see it,"Feb 12, 2021"
1988,PMLA case: Ex-ICICI CEO Chanda Kochhar appears before court,"Feb 12, 2021"
1989,View: India's plan to set up a bad bank to resolve NPA crisis is riddled with problems,"Feb 11, 2021"
1990,Indian Bank says customers may face service disruptions this weekend due to software migration,"Feb 11, 2021"
1991,Microfinance sector shrinks by 4% in the nine-month period,"Feb 11, 2021"
1992,Here's how you can avoid premature withdrawals from your bank fixed deposits,"Feb 11, 2021"
1993,India’s recovery reduces risk of a plunge in banks’ asset quality: Moody’s,"Feb 11, 2021"
1994,"Revamped Gold Scheme: Minimum deposit cut to 10 gm, jewellers roped in","Feb 10, 2021"
1995,SBI looking to double home loan portfolio to Rs 10 lakh crore in next five years: Chairman,"Feb 10, 2021"
1996,"RBI restricts withdrawals from Independence Co-operative Bank, Nashik","Feb 10, 2021"
1997,SBI crosses Rs 5 trillion-mark in home loan business,"Feb 10, 2021"
1998,Yes Bank CEO says foreign firms keen to invest in proposed asset reconstruction arm,"Feb 10, 2021"
1999,HDFC Bank beats SBI in Covid-19 scheme loans,"Feb 10, 2021"
2000,RBI seeks details of Punjab National Bank's capital raising plans,"Feb 9, 2021"
2001,Banks unions call for two-day strike against proposed privatisation of PSBs,"Feb 9, 2021"
2002,"Bad bank could help PSBs focus on growth, say experts","Feb 9, 2021"
2003,Service complaints by bank customers rise 57 pc to over 3 lakh: RBI report,"Feb 8, 2021"
2004,"Top 100 wilful defaulters owe lenders Rs 84,632 crore","Feb 8, 2021"
2005,Capital support for Indian govt banks to determine loan growth: Fitch,"Feb 8, 2021"
2006,"PNB expects Rs 3,800 cr recovery from Bhushan Power resolution; sees good amount from DHFL too","Feb 7, 2021"
2007,View: Sell the best public sector banks; bids can be foreign,"Feb 7, 2021"
2008,PNB MD Mallikarjuna Rao on setting up of a Bad Bank,"Feb 6, 2021"
2009,"Nabard disburses Rs 16,500 crore under RIDF in first 10 months of FY21","Feb 6, 2021"
2010,"View: To address India’s credit scarcity problem, allow corporate houses to set up banks","Feb 6, 2021"
2011,RBI MPC meet: Normalising CRR won’t crunch cash,"Feb 6, 2021"
2012,Bankers expect few takers for RBI's new TLTRO tap for shadow banks,"Feb 5, 2021"
2013,"Risks of bad loans recede even in a slowdown, NPLs are lesser than expected: Moody's","Feb 5, 2021"
2014,A deep dive being done to find out true state of NPAs,"Feb 5, 2021"
2015,"Three offers received for PMC Bank resolution, says RBI Governor Shaktikanta Das","Feb 5, 2021"
2016,"All remaining 18,000 bank branches to be under CTS by Sep: RBI","Feb 5, 2021"
