588,"Processed over 1 bn merchant transactions in Nov 2021, offline payments up 200 pc YoY: PhonePe","Dec 13, 2021"
589,View: India's banking revolution has started without the banks,"Dec 13, 2021"
590,"ICICI Bank scraps bell curve assessment: Hikes standardised, no more targets based on individual performance","Dec 13, 2021"
591,"Reforms keep middle class in mind, says FM Sitharaman","Dec 13, 2021"
592,Kotak Mahindra Bank appoints Ashu Suyash as director,"Dec 12, 2021"
593,"Bank of Maharashtra reduces home and car loans, but expects least impact on NIM","Dec 12, 2021"
594,NHB seeking agency for data collection on unsold residential units across 50 cities,"Dec 12, 2021"
595,Govt unlikely to announce capital infusion for PSU banks in Budget 2022-23,"Dec 12, 2021"
596,"NABARD projects Assam's credit potential at Rs 36,292cr for FY23","Dec 11, 2021"
597,"Yes Bank scam: Kapoor moves HC, seeks joint trial in the CBI-ED cases","Dec 10, 2021"
598,RBI grants approval to LIC to up stake in IndusInd Bank to nearly 10 pc,"Dec 10, 2021"
599,Govt averse to insolvency board regulating CoC,"Dec 10, 2021"
600,"With Future merger delayed, RBL Bank looks to sell ₹105-crore FCRPL debt","Dec 10, 2021"
601,Public sector bank disbursed most loans to MSMEs: Report,"Dec 9, 2021"
602,Bank credit could rise upwards of 10% in next one year: Jefferies,"Dec 9, 2021"
603,Karnataka Bank gets MeitY award for highest Bhim-Upi transactions for two years,"Dec 9, 2021"
604,India's Paytm Payments Bank granted status upgrade,"Dec 9, 2021"
605,Barclays plots Asia revival with strategic hires after hiatus,"Dec 9, 2021"
606,Reliance Capital asks creditors to submit claims,"Dec 8, 2021"
607,"Soon, UPI payments can be done through feature phones","Dec 8, 2021"
608,"Bankers welcome RBI stance amid Omicron fears, measures on digital payments","Dec 8, 2021"
609,How to read your mutual fund statement?,"Dec 8, 2021"
610,Fund of Funds: Your investment food court,"Dec 8, 2021"
611,Create a well-diversified portfolio with international mutual funds,"Dec 8, 2021"
612,Choose passive investing to enhance wealth creation,"Dec 8, 2021"
613,Wake Up! It’s time to review and rebalance your investment portfolio,"Dec 8, 2021"
614,"Banks do not need RBI permission to invest, pull back overseas investments","Dec 8, 2021"
615,"View: Cash is dying, but we aren’t ready to bury it","Dec 8, 2021"
616,"PSBs recovered over Rs 4.18 lakh cr related to frauds, defaults in last 3 fiscals: Minister","Dec 7, 2021"
617,HSBC executes its first SOFR-linked trade financing with Brookfield Renewable,"Dec 7, 2021"
618,Various measures taken to protect bona fide commercial decision of banks: FM Nirmala Sitharaman,"Dec 7, 2021"
619,Why are bank stocks underperforming?,"Dec 7, 2021"
620,The big bank outperformer? Analysts see upto 54% upside for ICICI Bank,"Dec 7, 2021"
621,Can't term bad business calls fraud: NCLT,"Dec 7, 2021"
622,"Citi's India retail business: Kotak, Axis Bank lead race","Dec 7, 2021"
623,Fears over omicron may impact retail securitisation volumes: Icra,"Dec 6, 2021"
624,RBI imposes curbs on Maharashtra-based Nagar Urban Co-op Bank,"Dec 6, 2021"
625,"PSBs restructure over Rs 58,500 crore loan advanced to 9.8 lakh MSME accounts amid pandemic: Govt","Dec 6, 2021"
626,Difference between investing in stocks and mutual funds,"Dec 6, 2021"
627,Federal Bank sells CNTL loan at 25% discount,"Dec 6, 2021"
628,Kotak breaks crypto ice with account for WazirX,"Dec 6, 2021"
629,Reverse repo rates revision could be between policies: SBI Research,"Dec 5, 2021"
630,Create UPI like platform for credit: Ashwini Vaishnaw to banks,"Dec 5, 2021"
631,"IT minister asks bankers to create robust, digital platform for easy credit availability to small businesses","Dec 5, 2021"
632,"SBI invites bids to sell NPA account KSK Mahanadi Power with dues over Rs 4,100 crore","Dec 5, 2021"
633,RBI's insolvency move against Reliance Capital may face hiccups,"Dec 4, 2021"
634,Federal Bank sells ITNL owned Chenani Nashri Tunnel debt to ACRE at 25% discount,"Dec 3, 2021"
635,Indian banks behind the curve in tapping payments tech: Uday Kotak,"Dec 3, 2021"
636,Bank employee associations plns to fight against government plan to privatise public sector banks,"Dec 3, 2021"
637,Aggregate bank deposits slump in fortnight to November 19 after abrupt rise in previous 15 days: Report,"Dec 3, 2021"
638,"PMC Bank fraud case: SC refuses to entertain bail plea of Rakesh Wadhawan, asks him to approach HC","Dec 3, 2021"
639,Bank deposits contract in the post Diwali fortnight,"Dec 2, 2021"
640,Dhanlaxmi Bank Part-Time Chairman G Subramonia Iyer resigns,"Dec 2, 2021"
641,Wondering if you should invest in Flexi Cap Funds? Here's what you need to know,"Dec 2, 2021"
642,SBI join hands with Adani Capital for co-lending to farmers,"Dec 2, 2021"
643,RBI action against Reliance Capital: Better late than never,"Dec 2, 2021"
644,Changes in Banking Regulation Act in works,"Dec 2, 2021"
645,"India's new crypto law set to red-flag chit fund, MLM business models","Dec 2, 2021"
646,FSS launches UPI eVoucher to advance financial inclusion,"Dec 1, 2021"
647,Private sector banks lower lending rates more than PSU Banks during the pandemic,"Dec 1, 2021"
648,Bank unions threaten two-day nationwide strike against proposed PSB privatisation,"Dec 1, 2021"
649,Deutsche Bank strengthens wealth management team in India,"Dec 1, 2021"
650,"HDFC, Axis Bank sold Reliance Capital debt facilities to ACRE","Dec 1, 2021"
651,"For bondholders of Reliance Capital, only half recovery likely","Dec 1, 2021"
652,Large corporates going back to banks amidst signs of capex pick up,"Nov 30, 2021"
653,Unwise for India to place bans on private crypto assets: Report,"Nov 30, 2021"
654,Non-food bank credit grows at 6.9% in Oct: RBI data,"Nov 30, 2021"
655,"Rs 26,697 cr lying in dormant accounts of banks: FM Sitharaman","Nov 30, 2021"
656,Dynamic asset allocation products and their importance,"Nov 30, 2021"
657,India could be the third-largest economy in the next decade; MFs may be one of the major beneficiaries,"Nov 30, 2021"
658,Three things banks need to keep in mind before leading a digital transformation,"Nov 30, 2021"
659,"Outlook for Indian banks is stable, says Moody's","Nov 30, 2021"
660,Unraveling of Reliance Capital shows why RBI hates big business in banking,"Nov 30, 2021"
661,Industry bodies urge RBI to scrap daily loan asset classification norm,"Nov 30, 2021"
662,CAG flags treatment of bank recap expenditure in FY18-19,"Nov 30, 2021"
663,RBI appoints P N Raghunath as additional director of Ujjivan Small Finance Bank,"Nov 29, 2021"
664,"IPO-bound India1 Payments installs 10,000 white-label ATMs","Nov 29, 2021"
665,"Banks write off Rs 46,382 crore NPA in H1","Nov 29, 2021"
666,LIC gets RBI approval to raise stake in Kotak Mahindra Bank,"Nov 29, 2021"
667,RBI imposes Rs 1 crore penalty on Union Bank of India,"Nov 29, 2021"
668,LIC gets RBI's approval to increase stake in Kotak Mahindra Bank,"Nov 29, 2021"
669,"View: Dear RBI, don’t penalise consumers and merchants for non-compliance by other stakeholders","Nov 29, 2021"
670,SIPs in Debt Funds - Here’s why they are beneficial to investors,"Nov 29, 2021"
671,Fedo launches “Health Savings Account” in partnership with neo bank Open,"Nov 29, 2021"
672,"NBFCs eyeing bank tag face a long wait, tighter regulations","Nov 29, 2021"
673,Hindujas ready $1.1 billion to up stake in IndusInd Bank,"Nov 29, 2021"
674,WhatsApp Pay plans significant investments in next six months,"Nov 29, 2021"
675,PNB puts up National Steel & Agro Industries for sale to recover Rs 200cr dues,"Nov 28, 2021"
676,Indusind Bank's Hindujas welcome RBI move to up promoter holding to 26%,"Nov 27, 2021"
677,Corporate exclusion from banking shrinks buyer pool for PSBs,"Nov 27, 2021"
678,Metro branches bring life back in bank credit growth,"Nov 26, 2021"
679,RBI imposes Rs 1 crore fine on State Bank of India,"Nov 26, 2021"
680,"Bank privatisation not in one go, govt may retain at least 26% in 2 PSBs","Nov 26, 2021"
681,Government to amend banking laws to facilitate privatisation of two PSU banks,"Nov 25, 2021"
682,How fintech apps have helped in financial inclusion,"Nov 25, 2021"
683,"IL&FS completes stake sale in Terracis Technologies, resolves Rs 1,275 cr debt","Nov 25, 2021"
684,4 reasons why you need to switch to a digital bank,"Nov 25, 2021"
685,"Central Bank of India, Indian Overseas Bank close sharply higher on disinvestment buzz, banks deny having knowledge on the matter","Nov 24, 2021"
686,Trai proposes cutting USSD charges for mobile banking to zero,"Nov 24, 2021"
687,View: Two tremendous transitions too soon for digital payments industry,"Nov 24, 2021"
688,World of phygital banking will be way forward: Bankers,"Nov 24, 2021"
689,Amtek takeover: DVIL gets 24 hours to pay ₹500 crore in cash,"Nov 24, 2021"
690,"Jan Dhan 3.0 to focus on digital, doorstep banking","Nov 24, 2021"
691,Eyeing market share gains ICICI open trade platform to non customers,"Nov 23, 2021"
692,"NCLT allows YES Bank time to file a reply in Dish TV matter, adjourns the case for December 22","Nov 23, 2021"
693,Equitas Small Finance Bank ties up with HDFC Bank to offer co-branded credit cards,"Nov 23, 2021"
694,"IndusInd Bank, Spandana Sphoorty spar over top management appointments","Nov 23, 2021"
695,"Punjab National Bank denies any data theft, system breach","Nov 23, 2021"
696,BCIC’s expert panel calls for efforts to link fintech firms & banks to step up support to MSMEs,"Nov 22, 2021"
697,Broad Peak joins hands with Brescon to raise $300 million to invest in distressed assets,"Nov 22, 2021"
698,"Digital payments led to rise in the buy-now-pay-later model, biz growth of local mom-and-pop stores: Study","Nov 22, 2021"
699,RBI scheme says PMC depositors to be paid over a period of 3 to 10 yrs,"Nov 22, 2021"
700,Deposits parked with co-operative credit societies not eligible for insurance cover: RBI,"Nov 22, 2021"
701,New twist in Spandana founder and Kedaara Capital's public spat,"Nov 22, 2021"
702,Co-operative societies can't use 'bank' in their names: RBI,"Nov 22, 2021"
703,Banks informing customers about crypto pitfalls,"Nov 22, 2021"
704,SBI yet to refund Rs 164 cr undue fee charged from Jan Dhan a/c holders,"Nov 21, 2021"
705,Vulnerability in PNB server exposed customer data for about seven months: CyberX9,"Nov 21, 2021"
706,IDFC First partners up with HPCL to facilitate fuel payments using FASTag,"Nov 19, 2021"
707,"PM Modi nudges banks to back wealth, job creators","Nov 19, 2021"
708,'Fresh round of bad loans likely if credit moratorium ends',"Nov 19, 2021"
709,"Punjab National Bank raises Rs 1,919 crore via bonds","Nov 18, 2021"
710,"Modi exhorts banks to support wealth, job creators; increase country's balance sheet","Nov 18, 2021"
711,Bank lending as well as deposits pick up by over Rs lakh crore during Diwali fortnight,"Nov 17, 2021"
712,"RBI slaps Rs 10.5 lakh penalty on Shri Kanyaka Nagari Sahakari Bank, Chandrapur","Nov 17, 2021"
713,"Bank credit grows at 7.14 pc, deposits at 11.42 pc: RBI","Nov 17, 2021"
714,"NPCI takes UPI global, ties up with leading payments provider PPRO","Nov 17, 2021"
715,Why investors should invest in equities or mutual funds,"Nov 17, 2021"
716,Real capex will revive in 9-12 months. says Axis Bank CEO Amitabh Chaudhry,"Nov 17, 2021"
717,IOB lowers yearly profit to Rs 646 cr on asset classification divergence,"Nov 16, 2021"
718,India has the potential to grow at a reasonably high pace: RBI Governor,"Nov 16, 2021"
719,Significant percentage of borrowers prefer online mode for securing loan: Survey,"Nov 16, 2021"
720,"Kotak Mahindra Bank, PVR launch co-branded debit card","Nov 16, 2021"
721,Business correspondent FIA Global eyes direct lending venture,"Nov 16, 2021"
722,Interoperable app brings big gains for ICICI in just 9 months,"Nov 16, 2021"
723,Bankers plan to seek safeguards against undue vigilance action,"Nov 16, 2021"
724,Issue of RBI disparity towards cooperative banks being addressed: MoS cooperation,"Nov 15, 2021"
725,Karnataka Bank launches premium product for SME businesses,"Nov 15, 2021"
726,"HDFC Bank to hold 2,000 workshops to prevent financial frauds","Nov 15, 2021"
727,"Bank of Maharashtra tops PSU lenders chart in terms of loan, saving deposit growth in Q2","Nov 15, 2021"
728,Ever heard about value funds? Here's what you should know,"Nov 15, 2021"
729,Govt to soon clear list of independent directors for various banks,"Nov 14, 2021"
730,"Restrictions put on Laxmi Coop Bank, Solapur; Rs 1,000 cap on withdrawals","Nov 12, 2021"
731,RBI asks banks not to standardise bad loans on just getting interest payments,"Nov 12, 2021"
732,Airtel Payments Bank to double business correspondent network to 1 million in a year,"Nov 12, 2021"
733,PM Modi launches RBI Retail Direct Scheme & Reserve Bank- Integrated Ombudsman Scheme,"Nov 12, 2021"
734,PM Modi launches two consumer-centric RBI initiatives,"Nov 12, 2021"
735,PM Modi to launch two innovative customer-centric initiatives of RBI today,"Nov 12, 2021"
736,Banks want more provisions included as statutory capital,"Nov 12, 2021"
737,Pension funds holding distressed Srei's bonds in a spot,"Nov 12, 2021"
738,SBI chalking out strategy to give loans based on ESG scores,"Nov 12, 2021"
739,Saving is not enough. Invest!,"Nov 11, 2021"
740,Suryoday Small Finance Bank reports net loss of Rs 1.9 crore for quarter ended September,"Nov 11, 2021"
741,Kotak Mahindra Bank completes acquisition of 10 per cent stake in KFin Technologies,"Nov 10, 2021"
742,Moody's upgrades Yes Bank on improved financial health,"Nov 10, 2021"
743,"BoB profit up, bank expects to keep credit costs in control","Nov 10, 2021"
744,UCO Bank enters co-lending agreement with Aadhar Housing Finance,"Nov 10, 2021"
745,RBI removes restrictions on Diners Club International,"Nov 9, 2021"
746,FM Nirmala Sitharaman to meet heads of PSBs next week; nudge them for credit expansion to boost economy,"Nov 9, 2021"
747,Indian Bank launches video KYC facility enabled by VCIP technology,"Nov 9, 2021"
748,Hyper-personalization and new-age tech will drive AI-enabled banks,"Nov 9, 2021"
749,Why the age of retirement is no longer 60?,"Nov 9, 2021"
750,"HSBC exceeds China wealth hiring targets, explores India private banking re-entry","Nov 9, 2021"
751,Ujjivan SFB tumbles 4% as asset quality woes take a toll on Q2 nos,"Nov 9, 2021"
752,Five bank stocks that could do well this year,"Nov 9, 2021"
753,"ICICI, Axis, SBI and PNB report sharp rise in bad loan recoveries","Nov 9, 2021"
754,Crypto market value tops $3 trillion for first time,"Nov 8, 2021"
755,States with more Jan Dhan accounts see crime rate fall: SBI,"Nov 8, 2021"
756,"RBI imposes curbs on Babaji Date Mahila Sahakari Bank; caps withdrawals at Rs 5,000","Nov 8, 2021"
757,Banks issue 31.67 crore RuPay debit cards to PMJDY account holders,"Nov 8, 2021"
758,Amazon Pay India's loss narrows by 18.8% in FY21,"Nov 8, 2021"
759,"Padmaja Reddy alleges exorbitant salary for new Spandana CEO, wants curb on salary for MFI chiefs","Nov 8, 2021"
760,Tech glitch led to disbursal of loans sans customer consent: IndusInd Bank,"Nov 6, 2021"
761,IT department freezes Rs 53-crore deposits of Maharashtra-based urban cooperative bank,"Nov 6, 2021"
762,"Indusind Bank says whistleblower claims baseless; gave 84,000 loans sans client consent in May","Nov 6, 2021"
763,"Bad-loan time bomb ticking at IndusInd Bank subsidiary, Whistleblowers warns: ET Reports","Nov 5, 2021"
764,"Mid-size firms, retail lead the charge in credit rebound","Nov 5, 2021"
765,ESG-linked fund mop-up may surge to a record this year,"Nov 5, 2021"
766,Whistleblowers raise loan evergreening issue at IndusInd arm,"Nov 5, 2021"
767,Pratip Chaudhuri's arrest: SBI's Dinesh Khara says former banker wasn't given a chance to be heard,"Nov 4, 2021"
768,Bank credit picks pace as economy revives,"Nov 3, 2021"
769,"State Bank of India's record profit led by retail loan growth, higher provisions","Nov 3, 2021"
770,Confident that Chaudhuri will be released unconditionally: SBI chairman Dinesh Khara,"Nov 3, 2021"
771,Ten commandments of wealth creation,"Nov 3, 2021"
772,"Goldman Sachs promotes 30 executives as MDs in India, the largest ever in the country","Nov 3, 2021"
773,More bankers express concern over ex-SBI chairman Pratip Chaudhuri's arrest,"Nov 3, 2021"
774,"Citibank to focus on institutional banking in India, to offer lease rental discounting","Nov 3, 2021"
775,Pratip Chaudhuri's arrest: New rules say police needs prior nod to act against PSU officials,"Nov 3, 2021"
776,"SBI former chairman arrest matter in court, Govt can't intervene","Nov 2, 2021"
777,"Updating credit assessment: Banks eye common social, climate framework","Nov 2, 2021"
778,RBI chief Shaktikanta Das asks bank heads to remain vigilant,"Nov 2, 2021"
779,Stressed asset sales should take place earlier: RBI report,"Nov 2, 2021"
780,RBI spells out rules for a bank to exit prompt corrective action framework,"Nov 2, 2021"
781,"RBI gearing up to fintech challenge, asks banks to be vigilant too","Nov 2, 2021"
782,"Banks sanction Rs 63,574 cr under credit outreach initiative: Finance Ministry","Nov 2, 2021"
783,Former SBI chairman Pratip Chaudhuri's arrest: Bankers shocked over ‘high-handed’ move,"Nov 2, 2021"
784,Deutsche Bank ready to be NPS custodian for just Rs 100 per year,"Nov 2, 2021"
785,"Unity Bank begins operations, paving way for merging PMC","Nov 1, 2021"
786,Yes Bank appoints Sharad Sharma as non-executive director,"Nov 1, 2021"
787,"Judicial, police high handedness shock bankers","Nov 1, 2021"
788,Government issues norms to protect bankers when bonafide decisions go wrong,"Nov 1, 2021"
789,Banks face pressure on NIM as they lower rates to outsmart rivals,"Nov 1, 2021"
790,"SBI issues clarification on Pratip Chaudhuri case, points to 'factual inaccuracies in complainant's version'","Nov 1, 2021"
791,"HDFC Q2 results: Net profit rises 32% YoY, beats Street’s estimate","Nov 1, 2021"
792,"Bandhan Bank now an Agency Bank of RBI, to conduct govt business","Nov 1, 2021"
793,SBI research sees higher job formalisation rate this fiscal,"Nov 1, 2021"
794,PSBs told to revise staff accountability policies for NPAs,"Oct 31, 2021"
795,Finance Ministry issues uniform norms for accountability to protect bonafide decision of bankers,"Oct 31, 2021"
796,Stressed PMC Bank customers not to get Rs 5 lakh deposit cover in first lot: RBI,"Oct 31, 2021"
797,Bank ownership in hands of corporates not desirable: ex-SBI chairman Rajnish Kumar,"Oct 30, 2021"
798,Indian Bank reports frauds of over Rs 266 crore in three accounts to RBI,"Oct 30, 2021"
799,RBI imposes Rs 56 lakh penalty on The Nainital Bank,"Oct 29, 2021"
800,RBI eases current account rules for bank exposures less than Rs 5 crore,"Oct 29, 2021"
801,Uco Bank Q2 results: Profit surges 7-fold to Rs 205 crore,"Oct 28, 2021"
802,"Delhi High Court asks RBI, SBI to respond to plea to revoke prohibition on use of UPI for cryptocurrency exchange","Oct 28, 2021"
803,More than 80% Indians support RBI move to stop auto debit: LocalCircles survey,"Oct 27, 2021"
804,Axis Bank to elevate Rajiv Anand as Deputy Managing Director,"Oct 27, 2021"
805,"Microfinance lenders should not throw caution to the winds while chasing growth, says RBI's Rajeshwar Rao","Oct 27, 2021"
806,RBI approves appointment of Baldev Prakash as J&K Bank MD & CEO,"Oct 27, 2021"
807,"Citi consumer business sale: Kotak Mahindra, Axis and IndusInd submit bids","Oct 27, 2021"
808,"Centre consults RBI for liberal PSB sale norms, looks for bigger pool of bidders","Oct 27, 2021"
809,Union Bank of India cuts home loan rates to 6.40 per cent,"Oct 26, 2021"
810,RBI imposes Rs 90 lakh penalty on Vasai Vikas Sahakari Bank,"Oct 26, 2021"
811,"Banks sanctions Rs 11,168 cr under credit outreach initiative","Oct 26, 2021"
812,India Post Payments Bank teams up with HDFC for offering home loans,"Oct 26, 2021"
813,Govt may not infuse capital into state-run banks in FY23,"Oct 25, 2021"
814,CCI approves HDFC Bank's acquisition of 4.99 pc stake in HDFC ERGO General Insurance Co,"Oct 25, 2021"
815,"CSB Bank's Q2 net profit up 72% at Rs 119 cr, NIM improves to 5.22%","Oct 25, 2021"
816,FSS Business Support Suite enables Philippines' BancNet to maximise billing and settlement efficiencies,"Oct 25, 2021"
817,Will Mint Street's digital currency ambition break the banking system?,"Oct 24, 2021"
818,P2P lending machine fires on all cylinders amid slackened bank loan disbursals,"Oct 24, 2021"
819,Bank of India opens first-ever branch in Ladakh,"Oct 22, 2021"
820,"India's central bank puts up a puzzling obstacle to a payments system, again","Oct 22, 2021"
821,Bank credit grows 6.48%; deposit by 10.16%,"Oct 21, 2021"
822,PSU banks likely to get capital support in Q4 to meet regulatory requirements,"Oct 21, 2021"
823,YES Bank Q2 results tomorrow: Profit or loss? Analyst views differ,"Oct 21, 2021"
824,"New rules put auto debits in no man's land, merchants forced to curtail services","Oct 21, 2021"
825,New norms put auto debits in no man's land,"Oct 21, 2021"
826,"RBI fines Paytm Payments Bank, Western Union","Oct 20, 2021"
827,RBI may be looking at changing its reserve management strategy,"Oct 20, 2021"
828,Gross NPAs of banks may decline to 6.9% by March 2022: Report,"Oct 20, 2021"
829,YES Bank showing remarkable progress; to take to two more years to stabilise: Former SBI chief,"Oct 20, 2021"
830,"Citi appoints Rajeev Mantri as CFO, Citi India and cluster finance head, south Asia","Oct 20, 2021"
831,"Banks flag concerns over US rules on consumer data, seek govt guidance","Oct 20, 2021"
832,SBI board wanted letter of support from govt before approving Jet Airways resolution plan: Rajnish Kumar,"Oct 19, 2021"
833,Axis Bank to waive 12 EMIs on select home loans under festive offer,"Oct 19, 2021"
834,Moody's upgrades outlook for Indian banks,"Oct 19, 2021"
835,Indian banks face rise in bad loans to 8-9% of lending: CRISIL,"Oct 19, 2021"
836,HDFC Bank suspends employees held for attempts of unauthorised withdrawal from high-value NRI account,"Oct 19, 2021"
837,"Banks hire for $93 billion India, Southeast Asia tech deal hunt","Oct 19, 2021"
838,RBI slaps penalty of Rs 1.95 crore on Standard Chartered Bank,"Oct 18, 2021"
839,RBI imposes penalty of Rs 1 crore on State Bank of India over non-compliance of directions,"Oct 18, 2021"
840,Here’s how digital banking helped me manage my money better,"Oct 18, 2021"
841,"Bitcoin hovers near six-month high on ETF hopes, inflation worries","Oct 18, 2021"
842,"Bank of India cuts home, vehicle loan rates","Oct 17, 2021"
843,Sundaram Finance to look at co-lending to add more asset classes: MD Rajiv Lochan,"Oct 16, 2021"
844,RBI clears re-appointment of Amitabh Chaudhry as MD of Axis Bank,"Oct 14, 2021"
845,UCO Bank CEO Atul Kumar Goel appointed chairman of Indian Banks' Association,"Oct 14, 2021"
846,RBI tells SBI to bid aggressively at next switch auction; redemptions need to be brought down,"Oct 14, 2021"
847,"RBI withdraws restrictions on Hindu Cooperative Bank, Pathankot","Oct 14, 2021"
848,PMC Bank fraud case: HC rejects Rakesh Wadhawan's medical bail plea,"Oct 14, 2021"
849,Five banks may bid for Citi's India consumer businesses,"Oct 14, 2021"
850,RBI authorises Karur Vysya Bank to collect direct taxes,"Oct 12, 2021"
851,Bank FD to fetch negative real interest with elevated inflation,"Oct 12, 2021"
852,Kotak Mahindra Bank launches Micro ATMs across India,"Oct 12, 2021"
853,Five foreign investors shortlisted for majority stake in Yes Bank-backed ARC,"Oct 12, 2021"
854,Need a loan? Just say 'Hi' on Whatsapp and get Rs 10 lakh instantly. Here's how to apply,"Oct 12, 2021"
855,RBI allows multinational banks to store limited data abroad,"Oct 12, 2021"
856,HDFC Bank inks lease renewal for head office building in Mumbai’s Worli,"Oct 11, 2021"
857,"RBI imposes Rs 30 lakh penalty on Janata Sahakari Bank, Pune","Oct 11, 2021"
858,"I-bankers make $761 million in advisory fees during Jan-Sept; lowest in three years, says report","Oct 11, 2021"
859,Uttarakhand: HDFC Bank launches 24 gold loan desks,"Oct 10, 2021"
860,Rupee Bank administrator seeks its merger with another lender,"Oct 9, 2021"
861,Court takes cognisance of charge sheet against Avantha Group promoter Gautam Thapar,"Oct 9, 2021"
862,Bandhan Bank's collection efficiency improves sharply,"Oct 8, 2021"
863,"Gradual unwinding of liquidity measures to support growth, keep inflation under control: Bankers","Oct 8, 2021"
864,"Bank of Maharashtra launches digital lending platform for home, car loans","Oct 8, 2021"
865,"CBI files charge sheet against Rana Kapoor and associates in Rs 1,700 crore scam","Oct 8, 2021"
866,RBI says reviewing ATM outage circular after bank’s feedback,"Oct 8, 2021"
867,RBI Guv responds to SBI note about excess liquidity; says banks must do own risk assessment,"Oct 8, 2021"
868,SBI internet banking will be down for some time this weekend. Check timings,"Oct 8, 2021"
869,RBI moves NCLT against SREI Equipment Finance and SREI Infra,"Oct 8, 2021"
870,RBI more than doubles limit on IMPS to Rs 5 lakh,"Oct 8, 2021"
871,RBI increases IMPS limit to Rs 5 lakh from Rs 2 lakh earlier,"Oct 8, 2021"
872,We have to lead sustainability indicators: SBI Chairman Dinesh Khara,"Oct 7, 2021"
873,"SREI group's financial health withered well before pandemic, says RBI order","Oct 7, 2021"
874,Eko to disburse $1 billion worth of loans in the next three to five years,"Oct 7, 2021"
875,Banks need to accelerate green lending to achieve sustainable growth: SBI chief Dinesh Khara,"Oct 7, 2021"
876,Bank of Baroda reduces home loans rates to 6.5%,"Oct 7, 2021"
877,Former SBI chairman Rajnish Kumar's memoirs to release on October 18,"Oct 7, 2021"
878,"Exim Bank targets 8-10% loan growth in FY2022, says Managing Director Harsha Bangari","Oct 7, 2021"
879,ICICI Bank executes first term loan derivative deal linked to SOFR,"Oct 7, 2021"
