0,Central Bank of India says not yet decided on branch closures,"May 8, 2022"
1,Indian Bank unveils digital broking solution,"May 7, 2022"
2,PNB hikes lending rate by 40 bps,"May 6, 2022"
3,Lenders to get 10-15 bps margin gains from rate hike: Report,"May 6, 2022"
4,RBI okays merger between Equitas Holding and Equitas Bank,"May 6, 2022"
5,"Banks follow RBI footsteps, start a rate hiking trail","May 6, 2022"
6,IDBI Trust invokes pledged investments in Future Group companies,"May 6, 2022"
7,PM Modi likely to launch 75 digital banks on August 15,"May 6, 2022"
8,Bank loans pick up at almost double the pace as last year,"May 5, 2022"
9,RBI's rate hikes to weigh down on banking system credit growth: India Ratings,"May 5, 2022"
10,"HDFC Bank opens over 1,000 branches during pandemic","May 5, 2022"
11,Central Bank of India to close 13% of its branches,"May 5, 2022"
12,RBI CRR hikes to increase overnight rates,"May 4, 2022"
13,"RBI taking inflation, inflationary expectations seriously: Uday Kotak","May 4, 2022"
14,RBI rate hike shocker: Home and car loans to get dearer,"May 4, 2022"
15,ASBA-designated bank branches to remain open on Sunday for LIC IPO: Reserve Bank,"May 5, 2022"
16,State-run banks voice concern over new guidelines on frauds,"May 3, 2022"
17,Primex Finance: Dismantling trading barriers with blockchain,"May 2, 2022"
18,RRA recommends withdrawal of 225 more circulars: RBI,"May 2, 2022"
19,Fino Payments Bank holdco says changes in board composition due to policy decision,"May 2, 2022"
20,Benefit of Early Investing,"May 2, 2022"
21,This Singapore firm helps banks open branches in remote locations for just $150,"May 2, 2022"
22,Kotak Mahindra bank backed Phoenix ARC set to acquire Bank of India's VVF (India) loan,"May 2, 2022"
23,HDFC raises home loan rate by 5 basis points for existing customers,"May 1, 2022"
24,Resolution primary objective of IBC; but need to be mindful of recovery too: SBI MD Swaminathan J,"May 1, 2022"
25,A few old private sector banks may look like convenient acquisition targets. But that may not be easy,"Apr 30, 2022"
26,"Aditya Birla ARC, Arcil among companies eyeing SBI's KSK Mahanadi loan","Apr 30, 2022"
27,Non-food bank credit grew 9.7% in March: RBI data,"Apr 29, 2022"
28,Vishu Ramachandran to Join as Chairman of GoPik Connect,"Apr 29, 2022"
29,Bank credit likely to grow at 4-year high of 11-12% in FY23: Report,"Apr 29, 2022"
30,Two government nominee directors join board of IDBI Bank,"Apr 29, 2022"
31,"Merger with private bank, NBFC proposed at IDBI Bank roadshows","Apr 29, 2022"
32,"Yes Bank scam: CBI arrests Radius Group MD, Sanjay Chhabria","Apr 28, 2022"
33,RBI modifies norms for banks on short term crop loan scheme,"Apr 28, 2022"
34,Indian Bank unveils pre-approved personal loan under Project WAVE,"Apr 28, 2022"
35,Things to know before investing in Short-Term Income Funds.,"Apr 28, 2022"
36,HDFC Bank plans car loan disbursal in 30 minutes in online push,"Apr 28, 2022"
37,Assam Gramin Vikash Bank posting net profit after a gap of 5 years,"Apr 27, 2022"
38,YES Bank approaches NCLT to admit Zee Learn under the insolvency resolution process,"Apr 27, 2022"
39,Jeevandas Narayan & Kalmanje Gururaj Acharya appointed to Karnataka Bank board,"Apr 27, 2022"
40,Cabinet approves Rs 820 cr financial support for India Post Payments Bank,"Apr 27, 2022"
41,"Guarantees, LoCs to group companies will now have taut strings","Apr 27, 2022"
42,NBFC 'third party lending' set to come under auditors' scrutiny,"Apr 26, 2022"
43,Investment advice for millennials,"Apr 26, 2022"
44,Union Bank rolls out automated solution to monitor stressed loans,"Apr 26, 2022"
45,Auto-debit bounce rates for loan EMIs inch up in March,"Apr 26, 2022"
46,"Credit push: State-run banks told to collaborate with startups, fintech cos","Apr 25, 2022"
47,Yes Bank files plea for insolvency proceedings against Zee Learn,"Apr 25, 2022"
48,RBI imposes Rs 1.12 crore penalty on Bank of Maharashtra,"Apr 25, 2022"
49,New CEO Vishakha Mulye will have to rebalance ABCL portfolio to extract synergies,"Apr 25, 2022"
50,Delhi HC stays Punjab & Sind Bank from taking further action on Srei,"Apr 25, 2022"
51,Banks seek formal NPCI note on crypto UPI curbs,"Apr 25, 2022"
52,"Airtel Payments Bank revenue seen rising to Rs 7,650 cr by 2030","Apr 25, 2022"
53,Six working groups set up to suggest ways to improve functioning of PSBs to submit report by Dec,"Apr 24, 2022"
54,ICICI Bank's Vishakha Mulye to join Aditya Birla Capital as CEO,"Apr 23, 2022"
55,"Yes Bank-DHFL case: Rana Kapoor, Kapil and Dheeraj Wadhawans laundered money worth Rs 5,050 crore, says ED","Apr 23, 2022"
56,Axis Bank turns down plan to distribute Sintex sale proceeds,"Apr 23, 2022"
57,Banks putting more of surplus funds in commercial papers as rates rise,"Apr 23, 2022"
58,DFS Secretary asks banks to soar up balancesheet; raise capital from market,"Apr 22, 2022"
59,BoB slashes home loan interest rate to 6.5 pc for limited period,"Apr 22, 2022"
60,"RBI, Bank of Russia officials discuss payment options","Apr 22, 2022"
61,Bank credit grows by 10.09 pc; deposits by 10.06 pc,"Apr 21, 2022"
62,"RBI issues new rules, penalties for credit & debit cards","Apr 21, 2022"
63,"HDFC Bank to open 150 branches in UP this year; to create 1,000 jobs","Apr 21, 2022"
64,NBFCs can't undertake credit card biz without prior approval: RBI,"Apr 21, 2022"
65,"Reliance ARC buys distressed loans from IOB, Jana SFB","Apr 21, 2022"
66,"Fino Payments Bank receives RBI nod to offer partner bank's FD, RD services","Apr 20, 2022"
67,IDBI Trustee allows vote in RHFL after Bombay HC go ahead,"Apr 20, 2022"
68,RBL finalises next MD; seeks RBI approval,"Apr 20, 2022"
69,Chinese banks continue to dominate; ICICI latest Indian entrant among top banks in APac,"Apr 20, 2022"
70,IBBI proposes tweaks in rules to reduce delays in corporate insolvency process,"Apr 20, 2022"
71,PSU bosses may be exempted from submitting passport info to banks,"Apr 20, 2022"
72,Grant loans to real estate sector after ensuring govt approvals for project: RBI to NBFCs,"Apr 19, 2022"
73,"SBI, BoB, others hike lending rates by up to 0.1 pc; EMIs to go up","Apr 19, 2022"
74,Cos should float their own NBFCs to fund road construction related projects: Gadkari,"Apr 19, 2022"
75,Do you believe that passive funds can be effectively used for asset allocation,"Apr 19, 2022"
76,"After I invest in a mutual fund, how soon will I get the certificate or statement of account?","Apr 19, 2022"
77,I am in my twenties. Is SIP the most secure way of investing for me?,"Apr 19, 2022"
78,How do I pick the right international mutual fund?,"Apr 19, 2022"
79,Is investing money in mutual funds good or should I go for stocks?,"Apr 19, 2022"
80,Is investing in global funds of Indian AMCs safe,"Apr 19, 2022"
81,What should I consider when investing in mutual funds?,"Apr 19, 2022"
82,SBI hikes MCLR by 10 bps on all types of loans,"Apr 19, 2022"
83,Digitally ready Bank of Baroda aims to click on more loans,"Apr 19, 2022"
84,Loan assets securitised by NBFCs jump 43 pc to Rs 1.25 lakh crore last fiscal: Report,"Apr 18, 2022"
85,SBI raises $500 million through IFSC Gift City branch,"Apr 18, 2022"
86,State Bank of India hikes lending rate by 10 bps across all loan tenors,"Apr 18, 2022"
87,"HDFC Bank to raise Rs 50,000 cr via bonds; re-appoints Renu Karnad as director","Apr 16, 2022"
88,HDFC moved NCLT against SITI Networks claiming default of Rs 296 cr,"Apr 15, 2022"
89,IDBI Bank seeks shareholders nod for 10-fold hike in MD & CEO salary,"Apr 15, 2022"
90,Kotak pauses crypto trade with CoinSwitch Kuber,"Apr 14, 2022"
91,Axis Bank committed to addressing needs of SMEs: MD & CEO,"Apr 13, 2022"
92,"Banks ask RBI to allow cloud adoption, list the dos & don'ts","Apr 12, 2022"
93,Will see capex recovery across sectors in coming years: KV Kamath,"Apr 12, 2022"
94,Merger of HDFC entities to increase M&A prominence among banks: Fitch,"Apr 12, 2022"
95,"PNB, IDBI Bank get govt nominee directors on their boards","Apr 12, 2022"
96,Moody's expects Indian banking sector to stabilise on economic rebound,"Apr 12, 2022"
97,"NBFC recovery to bring higher Q4 profits; funding costs to rise, too","Apr 12, 2022"
98,Kotak Mahindra Bank loan officer arrested,"Apr 12, 2022"
99,Phoenix ARC in talks with banks to acquire VVF India loans,"Apr 12, 2022"
100,Government nominates Hardik Mukesh Sheth as director to Central Bank of India's board,"Apr 11, 2022"
101,Decline in bad loans to improve profitability of banks: Report,"Apr 11, 2022"
102,"Arohan targets Rs 20,000 crore portfolio by 2027, to review capital raising plan","Apr 11, 2022"
103,"CreditAccess Grameen disbursements up 25% to Rs 2,257 cr in March","Apr 11, 2022"
104,"Eco recovery, improving business confidence to help banks in FY23: Moody's","Apr 11, 2022"
105,Banks' credit growth nearly doubles in FY22,"Apr 11, 2022"
106,Big NBFCs to decide their own future: RBI Governor,"Apr 9, 2022"
107,"Ruchi Soya repays entire loans of Rs 2,925 crore","Apr 8, 2022"
108,"RBI imposes penalties on Axis Bank, IDBI Bank","Apr 8, 2022"
109,"'We have been increasing deposit rates, will continue to do so': SBI MD Ashwini Tewari on RBI policy","Apr 8, 2022"
110,"Nuanced, calibrated approach essential for launch of CBDC, says Reserve Bank DG","Apr 8, 2022"
111,Bank of Baroda takes Gayatri Projects to NCLT over unpaid dues,"Apr 8, 2022"
112,RBI may ease cap on regional priority sector loan portfolios by regional rural banks,"Apr 8, 2022"
113,Trustees move Bombay HC against CCI challenging jurisdiction,"Apr 7, 2022"
114,RBI issues guidelines for banks to set up 24X7 digital banking units,"Apr 7, 2022"
115,Cost rises for micro borrowers as RBI deregulates lending rates,"Apr 7, 2022"
116,Axis Bank inks USD 150 mn partial guarantee pact with ADB to support supply chain financing,"Apr 7, 2022"
117,Bank of Maharashtra to divest entire 4% stake in ISARC,"Apr 7, 2022"
118,"Bandhan-led group to buy IDFC MF, deal valued at ₹4,500 crore","Apr 7, 2022"
119,"Govt should sell all its stake in PSU banks, insurers, says Prem Watsa","Apr 7, 2022"
120,"6 MNC banks red-flag February 7 holiday, say move put them at big risk","Apr 7, 2022"
121,Bandhan-led group wins bid to own IDFC MF,"Apr 6, 2022"
122,Union Bank of India to sell its 8 pc stake in ISARC to Dhansamridhi Finance,"Apr 6, 2022"
123,"Union Bank plans to invest Rs 1,000 crore in technology over two years","Apr 6, 2022"
124,Lenders mull 90-day extension to close Reliance Capital resolution process,"Apr 6, 2022"
125,"Rs 50,000 cr loans to be transferred to bad bank by April-end: Union Bank MD","Apr 6, 2022"
126,"Equitas SFB gross advances rise 15% to Rs 20,648 crore in FY22; deposits up 16%","Apr 6, 2022"
127,"RBL Bank gross advances up 3% at Rs 61,929 crore in FY22","Apr 6, 2022"
128,"Competition Commission probes debt trustee units of SBI, Axis, IDBI on suspected fee cartel","Apr 6, 2022"
129,HDFC Bank move: A financial mega-merger that’s all in the family,"Apr 6, 2022"
130,To be or not To be: NBFCs in India face their moment of truth,"Apr 6, 2022"
131,"After Axis and HDFC Bank, will Kotak Mahindra go the M&A way?","Apr 6, 2022"
132,Team Bandhan leads race to buy IDFC Mutual Fund,"Apr 6, 2022"
133,Bank credit to grow in double digits in FY'23: Report,"Apr 5, 2022"
134,"Yes Bank net advances up 8.8 pc to Rs 181,508 crore in FY22","Apr 5, 2022"
135,Bandhan Bank crosses Rs 1 lakh crore loans,"Apr 5, 2022"
136,Sharp rise in lending for both Ujjivan and Dhanlaxmi Bank,"Apr 5, 2022"
137,Bank credit growth likely to be at 8.9-10.2 pc this fiscal: Report,"Apr 5, 2022"
138,PhonePe to double employee count by December,"Apr 5, 2022"
139,"HDFC, HDFC Bank merger is coming together of equals, at the right time, says Deepak Parekh","Apr 5, 2022"
140,HDFC-HDFC Bank merger: Regulatory changes pave way for union,"Apr 5, 2022"
141,HDFC Bank CEO Sashidhar Jagdishan to lead merged entity,"Apr 5, 2022"
142,Ireda sanctions highest-ever loan of about Rs 24k cr in 2021-22,"Apr 4, 2022"
143,"Rs 150 crore out of Rs 1,500 crore paid for stalled Amrapali housing projects, SC told","Apr 4, 2022"
144,Federal Bank advances rise 10 pc to Rs 1.47 lakh cr in FY22; deposits up 5 pc,"Apr 4, 2022"
145,HDFC Bank petitions RBI to transfer stake from HDFC subsidiaries,"Apr 4, 2022"
146,Deepak Parekh to step aside after HDFC-HDFC Bank merger is consummated,"Apr 4, 2022"
147,"Why HDFC and HDFC Bank merger happened, Deepak Parekh explains","Apr 4, 2022"
148,Bank of Maharashtra's advances grow 27 pc to Rs 1.36 lakh crore in FY22,"Apr 4, 2022"
149,Chairman Deepak Parekh says HDFC found a home within the family,"Apr 4, 2022"
150,HDFC Bank merger to create entity twice the size of ICICI Bank: S&P,"Apr 4, 2022"
151,"Nearly 8 years ago, a RBI notification had triggered possible HDFC-HDFC Bank merger talks","Apr 4, 2022"
152,Mortgage lender HDFC announces merger with HDFC bank,"Apr 4, 2022"
153,Bad loan concerns have been proven to be overblown: SBI,"Apr 4, 2022"
154,Jammu & Kashmir Bank sets up special currency counter at Mata Vaishno Devi shrine,"Apr 3, 2022"
155,Banking sector in sweet spot; should see robust loan growth this year: BoM MD,"Apr 3, 2022"
156,RRBs need state of the art uniform regulations: Report,"Apr 1, 2022"
157,Acquisition of Citi India's consumer business to boost Axis Bank's retail franchise: S&P,"Apr 1, 2022"
158,SBI economists suggest reforms to incentivise regional rural banks,"Apr 1, 2022"
159,Explained: Axis Bank's $1.6 Billion takeover of Citibank's India consumer business,"Apr 1, 2022"
160,"Unity Small Finance Bank pays Rs 3,800 crore to 8.5 lakh PMC Bank depositors","Mar 31, 2022"
161,Banks get time till March 2023 to implement new system to replenish cash in ATMs,"Mar 31, 2022"
162,Asset Allocation – The Key to avoiding sleepless nights in investing,"Mar 31, 2022"
163,Large corporates going back to banks for funds,"Mar 31, 2022"
164,Canara Bank pares its stake in debt resolution firm IDRCL to 5 per cent,"Mar 31, 2022"
165,"ADB, HSBC India sign a $100 million partial-guarantee program to promote micro loans","Mar 31, 2022"
166,"Citi joins list of foreign banks scaling down India ops with Rs 12,325 cr arm sale to Axis Bank","Mar 31, 2022"
167,Payment apps are cornering the SME sector. What can India's old-fashioned lenders do?,"Mar 31, 2022"
168,SBI exploring new ways to resolve retail loan stress,"Mar 30, 2022"
169,"Citibank customers to continue availing rewards, privileges and offers: Axis Bank MD","Mar 30, 2022"
170,"NPAs to reduce in Q4, industry loss to be restricted to 5-6% of total microfinance loans, says Bandhan Bank MD Chandra Shekhar Ghosh","Mar 30, 2022"
171,"Axis Bank buys Citi's retail biz in India for Rs 12,325 cr","Mar 30, 2022"
172,Pandemic-related stress on unsecured loan assets over: HDFC Bank,"Mar 30, 2022"
173,Axis Bank buys Citibank India's consumer businesses for $1.6 billion,"Mar 30, 2022"
174,Axis Bank acquires Citi India’s retail assets for $1.6 billion,"Mar 30, 2022"
175,"Paytm has got customers by way of cashbacks, not by rendering services: Aditya Puri","Mar 30, 2022"
176,Axis Bank to acquire Citi India’s retail assets for $2 billion,"Mar 30, 2022"
177,"Bank of Russia, RBI to ready framework for trade, banking","Mar 30, 2022"
178,India loses Rs 100 crore to bank fraud every day over past 7 years: RBI,"Mar 29, 2022"
179,SBI to buy entire share of three stakeholders in SBI Global Factors,"Mar 29, 2022"
180,"IDBI Bank board okays rupee bond borrowing limit of Rs 8,000 cr for FY23","Mar 29, 2022"
181,"Public sector banks sufficiently capitalised, says MoS Finance Bhagwat K Karad","Mar 29, 2022"
182,HDFC Bank to infuse Rs 3 cr to acquire stake in debt resolution firm IDRCL,"Mar 29, 2022"
183,Banking services partially impacted on second day of strike by central trade unions,"Mar 29, 2022"
184,4 reasons to invest in ELSS funds,"Mar 29, 2022"
185,Corporates shun CPs in favour of bank funding,"Mar 28, 2022"
186,Shriram Transport set to wear a brand new look beginning April,"Mar 28, 2022"
187,"About 5,200 companies with credit exposure of over Rs 5 cr declared as NPAs till Dec 2021: MoS Finance","Mar 28, 2022"
188,"Microfinance market to turn interest sensitive in two years, borrowers will look for loans with lower rates: Suryoday Small Fin Bank MD Babu","Mar 28, 2022"
189,"Nationwide strike hits banking, public transport services in West Bengal, Kerala, other states","Mar 28, 2022"
190,Bank of Maharashtra bags best bank award from Kerala bankers' body,"Mar 27, 2022"
191,"SBI services could be impacted after unions call for strike on March 28, 29","Mar 27, 2022"
192,RBI releases framework for geo-tagging of payment system touch points,"Mar 25, 2022"
193,Banks lose microloan market share,"Mar 25, 2022"
194,RBI discusses trade payment option with Russian banks,"Mar 25, 2022"
195,IndusInd Bank to sell Future Retail loans to Edelweiss ARC,"Mar 25, 2022"
196,Banks to undertake special clearing ops on Mar 31 for closure of govt accounts,"Mar 24, 2022"
197,Sebi penalises Axis Bank for violating merchant bankers regulations,"Mar 24, 2022"
198,PNB acquires 6 per cent stake in public digital e-commerce platform,"Mar 24, 2022"
199,"Federal Bank, RBIH partner to advance digital financial inclusion for women","Mar 24, 2022"
200,RBI Governor Shaktikanta Das inaugurates Reserve Bank Innovation Hub (RBIH) in Bengaluru,"Mar 24, 2022"
201,"CBI probe in over Rs 21,000-cr bank fraud cases pending for consent from 5 non-BJP ruled states","Mar 24, 2022"
202,Banks are on a fundraising spree as economy shows signs of stability,"Mar 24, 2022"
203,"We have too few banks, need more access to common man: Sanjiv Bajaj","Mar 24, 2022"
204,"Banks share in industrial credit plunges to 34% in FY21, says report","Mar 23, 2022"
205,ICICI Bank partners with Chennai Super Kings for co-branded credit card,"Mar 23, 2022"
206,"Kotak, Axis acquire nearly 8% stake each in ONDC","Mar 23, 2022"
207,"Services may be hit as staff unions plan to go on strike on March 28, 29: SBI","Mar 22, 2022"
208,Spandana Sphoorty's founder and former MD Padmaja Reddy moves court,"Mar 22, 2022"
209,"Indian banks are unprepared to fight climate change, report says","Mar 22, 2022"
210,"YES Bank in talks with Brookfield, BlackRock to sell 5-10% stake via QIP: Report","Mar 22, 2022"
211,PNB board to consider debt raising plan for FY23 on March 29,"Mar 21, 2022"
212,"Banks recover Rs 61,000 crore via one-time settlement of loans","Mar 21, 2022"
213,RBI's retail direct a hit with investors as GSecs trump FDs,"Mar 21, 2022"
214,HDFC Bank to give a digital push to small business loans,"Mar 21, 2022"
215,SBI lines-up 12 NPA accounts for sale to ARCs to recover dues of over Rs 820 cr,"Mar 20, 2022"
216,Bank privatisation to be kickstarted soon,"Mar 18, 2022"
217,Yes Bank Scam: HC directs special CBI court to defer framing of charges until April 1,"Mar 17, 2022"
218,Things to know before investing in Short Term Income Funds,"Mar 17, 2022"
219,Tasks to complete before 31 March 2022,"Mar 17, 2022"
220,"Dear women, SIPs may help you wear different hats with ease","Mar 17, 2022"
221,Fewer EMI bounces point to drop in loan defaults,"Mar 17, 2022"
222,"Bank CEOs now think they are running technology companies: Bill Winters, CEO, Standard Chartered","Mar 17, 2022"
223,Banks in India may face headwinds from Russia-Ukraine crisis: S&P,"Mar 16, 2022"
224,Payment Aggregators help shape digital payments in India,"Mar 16, 2022"
225,Free pricing system to strengthen MFIs; but credit cost for borrowers to jump: Analysts,"Mar 15, 2022"
226,Time to dishonour Section 138? Why there is little reason to continue with India's cheque bounce law,"Mar 15, 2022"
227,PNB declares IL&FS Tamil Nadu Power Company's loan as fraud,"Mar 15, 2022"
228,BAF hai to jeet hai,"Mar 15, 2022"
229,Decoding Section 80C of the Indian Income Tax Act,"Mar 15, 2022"
230,"If mutual funds are taxed, then what are tax-free mutual funds? Confusion cleared!","Mar 15, 2022"
231,Banks recover over Rs 7.34 lakh cr in six-and-a-half years till Dec 2021,"Mar 15, 2022"
232,"No PSB employees found involved in Rs 14,349 cr ABG Shipyard fraud case: Sitharaman","Mar 15, 2022"
233,"RBI letter to Paytm Bank does not talk about data access, says Vijay Shekhar Sharma","Mar 14, 2022"
234,"At 642, Kotak Mahindra Bank hit by highest number of bank frauds of Rs 1 lakh and more in Apr-Dec FY22","Mar 14, 2022"
235,Bank frauds fall drastically over last 5 years to Rs 648 cr in Apr-Dec FY22: Minister,"Mar 14, 2022"
236,'Foreign' private banks need govt nod to back debt recast firm,"Mar 14, 2022"
237,Can India really overthrow Visa and Mastercard?,"Mar 14, 2022"
238,Taking immediate steps to comply with RBI directions: Paytm Payments Bank,"Mar 12, 2022"
239,RBI lifts all restrictions on HDFC Bank's business-generating activities,"Mar 12, 2022"
240,From feast to famine: Investors' guide to manoeuvre uncertainties,"Mar 12, 2022"
241,"Data localisation not the best solution; compliance to laws top priority, says Visa CEO","Mar 11, 2022"
242,RBI directs Paytm Payments Bank to immediately stop onboarding new customers,"Mar 11, 2022"
243,Punjab & Sind Bank to buy 2 per cent stake in bad bank NARCL for Rs 55 crore,"Mar 11, 2022"
244,RBI bans Paytm Bank from onboarding new customers,"Mar 11, 2022"
245,"Digitisation, innovative technologies creating unprecedented disruption in banking sector: SBI chairman Dinesh Khara","Mar 11, 2022"
246,State-owned banks on course to book better profits next fiscal: Report,"Mar 11, 2022"
247,Bank credit grows by 7.9 per cent; deposits by 8.6 per cent,"Mar 10, 2022"
248,Sidbi keen on coming out with venture debt scheme: CMD S Ramann,"Mar 10, 2022"
249,Projects with implementation risks should be financed by capital markets: Former RBI deputy governor,"Mar 10, 2022"
250,ToneTag in association with NSDL Payments Bank introduces voice-based UPI digital payment solutions for feature phones,"Mar 10, 2022"
251,Govt is making sure that India will have at least 75 digital banking units in near future: Nirmala Sitharaman,"Mar 10, 2022"
252,NaBFID to be regulated as AIFI under RBI Act,"Mar 9, 2022"
253,"Proposed digital currency by RBI to speed up transactions, reduce cost of cash: Deloitte","Mar 9, 2022"
254,RBI now brings UPI to feature phone users,"Mar 9, 2022"
255,HDFC Bank says will reverse market share loss as new cards join spending,"Mar 8, 2022"
256,IBA invites applications for full time NARCL CEO,"Mar 8, 2022"
257,Ukraine war may have limited impact on domestic credit market: Report,"Mar 8, 2022"
258,Wealth creation – Key things to keep in mind,"Mar 8, 2022"
259,Financial planning for artists; here are steps to ensure you are on the right track,"Mar 8, 2022"
260,Nine things every smart woman should know about money,"Mar 8, 2022"
261,RBI Governor Shaktikanta Das launches UPI service for feature phone users,"Mar 8, 2022"
262,Bank consortium informs SC of Rs 300 crore infusion for completion of stalled Amrapali projects,"Mar 7, 2022"
263,"Airtel, Axis Bank partner for financial services; launch co-branded credit card","Mar 7, 2022"
264,The future of banking is digital,"Mar 7, 2022"
265,Foreign lenders need regulatory support: Grant Thornton Bharat Report,"Mar 7, 2022"
266,"Awaiting govt, RBI guidelines on SWIFT transactions with Russian entities: PNB","Mar 6, 2022"
267,BBB launches programme for improving quality of PSU bank boards,"Mar 6, 2022"
268,SBI appoints ex-Ujjivan Small Finance Bank CEO Nitin Chugh as DMD,"Mar 6, 2022"
269,RBI asks banks to find alternative mechanism for Russia payments,"Mar 5, 2022"
270,"Banks, NBFCs raise lending rates as tighter liquidity, deposit costs pinch","Mar 5, 2022"
271,Geopolitical tensions new challenge to monetary policy: RBI governor,"Mar 4, 2022"
272,Carlyle plans to acquire 10 per cent in Yes Bank for $500-600 million,"Mar 4, 2022"
273,A woman’s best protection is a little money of her own,"Mar 3, 2022"
274,Equity Basics: Don’t panic in falling and rising market,"Mar 3, 2022"
275,Tijoree launches Smart & Gamified Banking for India’s Teens,"Mar 3, 2022"
276,RBI cancels banking licence of Sangli-based Sarjeraodada Naik Shirala Sahakari Bank,"Mar 2, 2022"
277,"RBI cancels licence of Sarjeraodada Naik Shirala Sahakari Bank, Sangli","Mar 2, 2022"
278,Consumer demand remains strong but delinquencies also inch up: Cibil data,"Mar 2, 2022"
279,Explained: Will SWIFT ban choke Russia’s international money flow?,"Mar 2, 2022"
280,UCO Bank ties up with Fisdom for launching paperless facilities,"Mar 2, 2022"
281,Canara Bank hikes fixed deposit rates by up to 25 basis points,"Mar 1, 2022"
282,PNB to clear cheques of Rs 10 lakh & above after customer confirmation from Apr 4,"Mar 1, 2022"
283,Axis Finance drags Essel promoters to HC over unpaid dues,"Mar 1, 2022"
284,State Bank of India stops handling trade with sanctioned Russian entities: Sources,"Mar 1, 2022"
285,6 reasons why you must start planning your taxes right away,"Feb 28, 2022"
286,Want to meet different financial goals? Say hello to goal-based investing!,"Feb 28, 2022"
287,This is what you need to know before investing in Large Cap Funds,"Feb 28, 2022"
288,Former Finance Secy Hasmukh Adhia nominated again as BoB chairman,"Feb 28, 2022"
289,Standard Chartered India appoints Saurabh Jain as head of wealth management,"Feb 28, 2022"
290,Indian banks await government's orders on dealing with Russian lenders,"Feb 28, 2022"
291,"PE firms partner each of four IDFC MF suitors; TPG-IndusInd, Bandhan Bank-GIC among consortia in fray","Feb 28, 2022"
292,Govt to provide capital support mostly to weak PSBs,"Feb 27, 2022"
293,NPCI focusing on new customers to expand RuPay credit card base,"Feb 27, 2022"
294,India may set up rupee trade accounts with Russia to soften sanctions blow,"Feb 26, 2022"
295,Secured lenders reject IL&FS' Jammu tunnel debt recast plan,"Feb 26, 2022"
296,Top 7 financial pitfalls to avoid in retirement,"Feb 25, 2022"
297,Equities - Perceived risk versus real risk,"Feb 25, 2022"
