0,Ideas For Profit | IndusInd Bank: Will the stock continue to outperform peers and Nifty50?,"May 02, 2022 06:37 PM IST"
1,Ideas For Profit | Why Equitas Small Finance Bank has a re-rating potential,"Apr 19, 2022 09:59 PM IST"
2,"Banks, insurance, Cement: Key sectors that brokerage Nirmal Bang is positive on","Mar 10, 2022 04:27 PM IST"
3,Ideas For Profit | IndusInd Bank: Attractive valuation & strong earnings visibility to aid stock re-rating,"Jan 31, 2022 08:55 PM IST"
4,Ideas For Profit | Axis Bank: All set to close valuation gap with private sector peers,"Jan 25, 2022 11:06 PM IST"
5,Ideas For Profit | HDFC Bank: Strong Q3 result on lower provisions; Can stock bounce back in 2022?,"Jan 17, 2022 08:32 PM IST"
6,Improved balance sheet and asset quality to aid Q3 results for banks; Which stocks do analysts prefer?,"Jan 14, 2022 12:14 PM IST"
7,"CSB Bank MD & CEO Rajendran opts for early retirement, to step down on March 31","Jan 08, 2022 04:58 PM IST"
8,Karur Vysya Bank names Ramshankar R as CFO with effect from Feb 10,"Dec 09, 2021 05:08 PM IST"
9,Will the NARCL cleanse India’s banking system?,"Sep 17, 2021 01:21 PM IST"
10,NARCL a game-changer for India's bad debt resolution,"Sep 16, 2021 07:56 PM IST"
11,Stage set for Nifty Bank revival; which stocks should you buy?,"Sep 03, 2021 02:06 PM IST"
12,These were favourite sectors of MFs in May,"Jun 18, 2021 01:14 PM IST"
13,The macro implications of Q4 bank earnings,"May 31, 2021 01:17 PM IST"
14,"Ideas For Profit | Amid the scare of second wave of COVID, which bank stocks should investors bet on?","Apr 14, 2021 05:13 PM IST"
15,RBI rejects Yes Bank's ARC proposal citing 'conflict of interest': Report,"Mar 14, 2021 08:00 PM IST"
16,Karnataka Bank reports Rs 34.16-crore fraud to RBI,"Feb 20, 2021 03:58 PM IST"
17,Budget 2021 proposals to shake up banking sector,"Feb 01, 2021 07:21 PM IST"
18,"Union budget 2021: Creation of bad bank, additional demand stimulus measures key for banking sector","Jan 05, 2021 02:31 PM IST"
19,Budget 2021 expectations | Govt support may be required again to recapitalise public banks,"Dec 30, 2020 06:29 PM IST"
20,Two reasons why the banking sector is not out of trouble,"Dec 03, 2020 01:05 PM IST"
21,Business Insight | RBI panel proposes conversion of large NBFCs to banks; industry cautious,"Nov 25, 2020 04:06 PM IST"
22,Why banks are buying more bonds,"Nov 20, 2020 11:35 AM IST"
23,Banking sector likely to see unprecedented increase in bad loans: Raghuram Rajan,"Jul 15, 2020 09:51 AM IST"
24,"Indian corporates have one of the largest funding gaps, finds BIS study of 19 countries","Jul 03, 2020 10:16 AM IST"
25,Watch: Ideas For Profit | Decoding the impact of COVID-19 on HDFC Bank's performance,"Mar 27, 2020 09:53 PM IST"
26,The Moneycontrol Explainer | Why are the shares of IndusInd Bank nosediving?,"Mar 21, 2020 10:06 AM IST"
27,Explained I Yes Bank crisis: Here's what investors should do,"Mar 06, 2020 07:16 PM IST"
28,Reporter's Take | Budget 2020: Reviving the banking sector,"Jan 29, 2020 09:59 PM IST"
29,"Banking sector is stressed, govt in no position to bail it out: Abhijit Banerjee","Jan 26, 2020 07:32 PM IST"
30,Budget 2020: Things to watch out for the banking sector,"Jan 24, 2020 11:52 AM IST"
31,"Banking sector eyes better days on reforms, bad loan resolutions","Dec 30, 2019 11:45 AM IST"
32,Bad loans of banks may rise to 9.9% by September 2020: RBI,"Dec 27, 2019 06:44 PM IST"
33,Explained | SBI under-reported bad loans in FY19,"Dec 14, 2019 08:52 AM IST"
34,3 Point Analysis | Is RBL Bank a good buy?,"Dec 06, 2019 06:23 PM IST"
35,PMC Bank auditor Lakdawala & Co under scanner: Report,"Oct 03, 2019 10:17 AM IST"
36,Banking services impacted on Wednesday due to strike,"Dec 26, 2018 11:40 AM IST"
37,"Digital assistants, social media to be key for banking sector by 2022: Report","Nov 07, 2018 04:48 PM IST"
38,"Buy or Sell | Bank on autos, oil, says 5nance.com","Nov 06, 2018 04:36 PM IST"
39,Govt may approach RBI to dilute banks' minimum capital requirement,"Aug 07, 2018 01:29 PM IST"
40,Podcast | Here's a review of India's banking sector in last 12 months,"Jun 01, 2018 08:25 PM IST"
41,Piyush Goyal vows to clean up banking sector,"May 17, 2018 01:55 PM IST"
42,Banks still averse to lend to gems & jewellery players: SBI,"May 11, 2018 08:23 PM IST"
43,Parliamentary Panel to quiz FinMin officials on April 17 on bank NPAs,"Apr 12, 2018 06:25 PM IST"
44,Banks stare at $38 bn new dud loans from power sector: Report,"Apr 04, 2018 06:45 PM IST"
45,Budget 2018 to fix public sector banks and make them nimble,"Feb 01, 2018 09:15 AM IST"
46,"Banking this week: Govt announces Rs 88,000 crore gift for 18 PSBs; all eyes Budget 2018","Jan 27, 2018 08:17 PM IST"
47,NPAs to rise to Rs 9.5 lakh cr by March-end: Report,"Jan 22, 2018 02:57 PM IST"
48,"Banking sector this week: Axis Bank hikes loan rates, HDFC Bank posts NPA divergences; FDI buzz cheers stocks","Jan 20, 2018 06:56 PM IST"
49,The nine banks that will gain out of PSU recapitalisation,"Nov 29, 2017 12:10 PM IST"
50,India's troubled banks desperately need more money - but government help just isn't coming,"Oct 18, 2017 10:52 AM IST"
51,Govt adviser says consolidation may lead to 10-15 state banks,"Oct 06, 2017 10:46 AM IST"
52,Ministers' panel to be set up to oversee state bank consolidation: Arun Jaitley,"Aug 23, 2017 03:41 PM IST"
53,Do PSU banks matter to the financial system anymore?,"Aug 23, 2017 02:09 PM IST"
54,"Banking sector this week: RBI transfers lower dividend, assures banknotes quality; SBI, Bank of Baroda posts high NPAs","Aug 12, 2017 01:32 PM IST"
55,Banks may need 20% incremental provisioning for 50 large NPAs,"Aug 03, 2017 03:45 PM IST"
56,Sector round up — Here's what transpired at major banks this week,"Apr 29, 2017 02:39 PM IST"
57,"HDFC Bank focuses on expanding corporate loan book, refinancing and term loans","Mar 31, 2017 01:38 PM IST"
58,Note ban to affect NBFC collections in short term: Moody's,"Mar 21, 2017 02:24 PM IST"
59,India mulls local steel requirement for &#36;59 bn infra spend,"Mar 07, 2017 11:46 AM IST"
60,Liquidity will drive mkt even as economy weak: Ajay Srivastava,"Mar 02, 2017 11:05 AM IST"
61,Banking not a saturated industry in India: Edelweiss,"Mar 01, 2017 12:45 PM IST"
62,Banking sector may recover very marginally from low base: S&P,"Feb 28, 2017 03:50 PM IST"
63,'Bad bank' to speed up stressed assets resolution: Fitch,"Feb 24, 2017 11:54 AM IST"
64,"Until bad loans are sorted, consolidation in PSBs will take time","Feb 21, 2017 04:56 PM IST"
65,"Bad bank is a good idea, says Uday Kotak","Feb 16, 2017 09:46 PM IST"
66,Kotak-Axis merger in the works? Both banks say no,"Feb 09, 2017 08:39 AM IST"
67,Why did 5% of HDFC Bank's staff leave in Q3?,"Jan 26, 2017 05:08 PM IST"
68,ICRA expects borrowers to switch from base rate to MCLR,"Jan 18, 2017 10:42 AM IST"
69,Banks' GNPAs rise to 9.1% in September from 7.8% in March: RBI,"Dec 30, 2016 08:32 AM IST"
70,Sectoral trends experts are betting on for 2017,"Dec 26, 2016 02:09 PM IST"
71,Fitch retains 'negative' outlook for India's banking sector,"Nov 22, 2016 01:52 PM IST"
72,"Realty, agri & banking to benefit from demonetisation: Edelweiss","Nov 10, 2016 09:48 AM IST"
73,Cabinet may decide on listing of PSU insurers this month,"Nov 07, 2016 07:14 PM IST"
74,"Mkt consolidating at current levels, good for near-term: Expert","Oct 28, 2016 01:02 PM IST"
75,"India's bad loan mountain grows, risks delaying bank clean-up","Oct 10, 2016 05:43 PM IST"
76,Liquidity can  take mkt to new highs; pharma a dark horse: Ambit,"Jul 28, 2016 10:35 AM IST"
77,'Digitalization will transform banks but PSBs need to worry',"Jul 12, 2016 01:08 PM IST"
78,"Corporate leverage in decline, banking strain remains: DBS","Jul 08, 2016 02:08 PM IST"
79,"Axis Bank Launches `Thought Factory`, an Innovation Lab to Drive FinTech Innovation","Jun 29, 2016 05:16 PM IST"
80,'Anyone saying PSBs have turned around is selling you a lemon',"May 27, 2016 08:32 PM IST"
81,Time to think of policy on dealing with bank failures: Kotak,"May 15, 2016 01:16 PM IST"
82,Bankruptcy Code very positive financial sector reform: Nomura,"May 12, 2016 02:16 PM IST"
83,'Banks should provide hassle-free services to start-ups in J-K',"May 09, 2016 07:28 AM IST"
84,Ambitious new bankruptcy code may take yrs to clean up debt mess,"May 02, 2016 09:33 AM IST"
85,India faces risk of earnings downgrades: HSBC,"Apr 11, 2016 12:22 PM IST"
86,Credit Suisse conference takeaways:Investors overweight on India,"Apr 06, 2016 04:14 PM IST"
87,Banks see a plunge in advance tax payments as NPAs bite,"Mar 16, 2016 12:08 PM IST"
88,Crisis-hit banking sector: Who is to be blamed?,"Mar 15, 2016 10:49 AM IST"
89,"Govt to provide more capital to PSU bks, if needed: Jayant Sinha","Mar 04, 2016 03:20 PM IST"
90,All eyes on govt's plans for banking sector: Crossbridge Capital,"Feb 23, 2016 05:39 PM IST"
91,"Budget to focus on bad banks, recapitalisation: SBI Research","Feb 22, 2016 03:44 PM IST"
92,Investors to stay cautious in run-up to Budget: Experts,"Feb 08, 2016 04:48 PM IST"
93,Banks need to live on the edge in this age: Uday Kotak,"Feb 04, 2016 08:28 PM IST"
94,Rajan says RBI working to clean up lenders' balance sheets,"Jan 30, 2016 12:52 PM IST"
95,Don't see Yes Bank asset quality worsening in FY17: Religare,"Jan 29, 2016 12:23 PM IST"
96,"Buy select largecaps, retail-focussed pvt banks: BNP Paribas","Jan 29, 2016 10:00 AM IST"
97,"Road projects covering 10,000 km to be awarded this fiscal: FM","Jan 28, 2016 02:02 PM IST"
98,"Continue to see Sensex at 22k on slow economy, bk stress: Ambit","Jan 15, 2016 06:53 PM IST"
99,Economists meet Arun Jaitley ahead of Union Budget,"Jan 13, 2016 06:45 PM IST"
100,Market to be volatile in near term; downside limited: Experts,"Jan 08, 2016 04:24 PM IST"
101,"See &#36; weakening in short term; like banks, hospitality cos:Ambit","Dec 30, 2015 10:48 AM IST"
102,"Rewind 2015: The hits, the misses and more, in a glimpse","Dec 24, 2015 08:05 PM IST"
103,Newsmaker 2015: Raghuram Rajan,"Dec 23, 2015 10:21 PM IST"
104,Avendus-KKR deal reopens old trend: i-banks diversification,"Nov 18, 2015 11:18 AM IST"
105,Piyush Goyal sees &#36;30bn savings from discom revival by FY19,"Nov 10, 2015 08:00 AM IST"
106,"Q2 topline growth subdued, but margin expansion good: Ambit","Oct 27, 2015 09:53 AM IST"
107,"Prefer Axis Bank, HDFC Bank, DCB, Federal Bank: RSec","Oct 14, 2015 02:28 PM IST"
108,Profitability prospects of banks not bright: BMI Research,"Oct 07, 2015 08:27 PM IST"
109,Still bottom-up stock picking mkt; OW on IT: Nilesh Shah,"Oct 07, 2015 03:59 PM IST"
110,50 bps rate cut won't impact economy in big way: Macquarie,"Sep 30, 2015 10:59 AM IST"
111,Govt may consider cutting stake in state-run banks: Jaitley,"Sep 28, 2015 02:44 PM IST"
112,Banking sector performance study - FY15: CARE Ratings,"Aug 26, 2015 05:30 PM IST"
113,Worldwide Achievers Felicitated the Winners of Business - Realty Leaders Summit & Awards 2015,"Aug 21, 2015 05:44 PM IST"
114,"Midcaps overvalued; buy small, largecaps: ICICI Pru","Aug 10, 2015 10:20 AM IST"
115,Make 15% of PSB branches all-women: Par panel to Fin Min,"Aug 09, 2015 07:53 PM IST"
116,Bankers see higher PPF rate limiting more deposit rate cuts,"Aug 02, 2015 04:35 PM IST"
117,IDFC gets banking licence from Reserve Bank of India,"Jul 24, 2015 11:36 AM IST"
118,Federal Bank Q1 shows steel loans a ticking bomb for banks,"Jul 20, 2015 01:17 PM IST"
119,Can't think of 5 bank names to buy in next 2 weeks:Mohindar,"Jun 30, 2015 09:37 AM IST"
120,Bad loans won't ease until Mar: RBI's Fin Stability Report,"Jun 25, 2015 05:33 PM IST"
121,Govt pushes for faster resolution of bad loans,"Jun 16, 2015 11:21 AM IST"
122,Expect slippages to remain high; NPA woes not over: Crisil,"May 12, 2015 03:21 PM IST"
123,China cuts interest rates to boost economy,"May 10, 2015 03:02 PM IST"
124,"Bull market over, just a step away from panic: Dimensions","May 07, 2015 10:00 AM IST"
125,Rajan sees 'great' changes in banking sector,"Apr 10, 2015 06:05 PM IST"
126,Modi wants RBI to prepare 20 yr road map for fin inclusion,"Apr 02, 2015 01:38 PM IST"
127,RBI moves to restrict bank exposure to corporate loans,"Mar 28, 2015 12:31 PM IST"
128,India to boost LNG imports to raise power generation,"Mar 26, 2015 09:33 AM IST"
129,Axis Bank best pick in private banking space: ICICIdirect,"Mar 24, 2015 05:47 PM IST"
130,See earnings growth improve in '16; like ITC: Jeff Chowdhry,"Mar 20, 2015 09:44 AM IST"
131,Union Budget 2015: State-banks have much to complain from Jaitley's Budget,"Mar 02, 2015 06:47 PM IST"
132,Union Budget 2015: Fiscal reforms to determine ratings: Moody's,"Feb 25, 2015 10:33 AM IST"
133,Betting on PSU banks on domestic recovery story: Prabhudas,"Feb 05, 2015 01:08 PM IST"
134,CCI rejects cartelisation charges against 12 banks,"Jan 05, 2015 05:37 PM IST"
135,Avoid infra companies; upbeat on banks: Dipan Mehta,"Dec 08, 2014 11:45 AM IST"
136,Govt correctly approaching banking sector reforms: Deutsche,"Nov 14, 2014 10:53 AM IST"
137,Ratings upgrade some time away; to watch deficit: Moody's,"Nov 05, 2014 09:10 AM IST"
138,Banks lead October series; Nifty hits record highs,"Oct 30, 2014 04:57 PM IST"
139,Mkt in consolidation phase; like midcaps: Birla Sun Life,"Oct 28, 2014 11:51 AM IST"
140,"New Basel III norms to benefit BOI, Union, Allahabad Bank","Sep 05, 2014 06:15 PM IST"
141,"Need banks, oil & gas play to push market higher: Motilal","Aug 27, 2014 09:17 AM IST"
142,"Banking: Asset quality pain continues unabated, says Angel","Feb 25, 2014 01:49 PM IST"
143,"Banks' loan growth weak, NII slump to continue: Kotak","Feb 18, 2014 03:28 PM IST"
144,Health of banks worsened in past six months: RBI,"Dec 30, 2013 03:57 PM IST"
145,"Plan no-gift policy, 2-year sabbatical for women: SBI Chmn","Dec 23, 2013 10:31 PM IST"
146,Growth in banking sector a great achievement: Chidambaram,"Dec 23, 2013 04:55 PM IST"
147,Challenging macro weighs on PSU' earnings: Angel Broking,"Nov 26, 2013 02:44 PM IST"
148,25% of sector's rejigged loans can slip into NPAs: Axis Bk,"Oct 31, 2013 12:37 PM IST"
149,Axis Bank Q2 nos look good; remains top pick: Angel,"Oct 17, 2013 03:46 PM IST"
150,"Emkay positive on HDFC, LIC Housing; hold M&M Fin Serv","Oct 14, 2013 08:13 PM IST"
151,Aditya Narain neutral on banking sector,"Oct 07, 2013 12:26 PM IST"
152,"Kotak Mah, HDFC Bank top picks; avoid Yes Bank: Macquarie","Sep 12, 2013 12:08 PM IST"
153,Go long on banks; mkt volatility not over yet: ICICI Pru,"Sep 11, 2013 09:53 PM IST"
154,"On-tap licence good idea, but are there shortage of banks?","Sep 06, 2013 01:26 PM IST"
155,Stay defensives in near term for banking space: Angel,"Aug 29, 2013 03:33 PM IST"
156,"Erratic rupee pain for mkt; stay with auto, IT: Antique","Aug 22, 2013 09:29 AM IST"
157,Exit ICICI Bank around Rs 1000-1080: Sanjeev Agarwal,"Jul 24, 2013 06:45 PM IST"
158,RBI may rollback volatility curbing moves if rupee sees 58,"Jul 24, 2013 08:43 AM IST"
159,Banking experts hail RBI‘s short-term rein on rupee,"Jul 23, 2013 11:27 PM IST"
160,Target 13% growth in premium collection this year: LIC,"Jul 09, 2013 05:10 PM IST"
161,"Videocon rises 5% on banking foray, stake sale in gas field","Jun 26, 2013 12:01 PM IST"
162,"Diversified equity funds rise in April, gold ETFs struggle","May 02, 2013 01:22 PM IST"
163,Kotak Mutual Fund overweight on banking sector,"Apr 29, 2013 10:41 AM IST"
164,Unlikely for Nifty to breach 6000 soon: Dipan Mehta,"Apr 19, 2013 01:57 PM IST"
165,Update on credit clustering by banks: Emkay,"Mar 28, 2013 07:31 PM IST"
166,Expect better FY14 for public sector banks: Macquarie,"Feb 15, 2013 12:36 PM IST"
167,"CDR rules to fortify banks, cut project-risk: India Ratings","Feb 08, 2013 02:36 PM IST"
168,MF exposure to banking stock soars to over 3-yr high,"Feb 05, 2013 06:29 PM IST"
169,"SBI to get lion share of Rs 12,200 cr bank infusion","Jan 10, 2013 10:13 PM IST"
170,"Short banks, go long on oil & gas: Edelweiss","Jan 04, 2013 10:25 AM IST"
171,Expect some capital infusion from GoI in FY13: IDBI,"Dec 28, 2012 03:55 PM IST"
172,Why to expect more gains for Asia's big banks in 2013,"Dec 26, 2012 01:17 PM IST"
173,Amended legislation paves way for new banks next year,"Dec 26, 2012 12:58 PM IST"
174,"Non-financial, banking shares gain after key bill passed","Dec 19, 2012 09:36 AM IST"
175,"New draft guidelines for NBFCs, no material impact: Emkay","Dec 14, 2012 02:36 PM IST"
176,Sectoral deployment of credit by banks: Emkay,"Dec 05, 2012 03:22 PM IST"
177,Spain makes formal request for EU bank aid,"Dec 03, 2012 06:56 PM IST"
178,'Chinese banks largely healthy despite potential risks',"Nov 12, 2012 03:46 PM IST"
179,Bank‘s credit growth may increase by 16.5%: AnandRathi,"Oct 08, 2012 03:39 PM IST"
180,"Banking sector may outperform, says Sukahni","Sep 21, 2012 06:15 PM IST"
181,Yes Bank top pick in banking space: Angel Broking,"Sep 14, 2012 01:39 PM IST"
182,"Funds, resources ready for banking foray: Reliance Capital","Sep 04, 2012 02:41 PM IST"
183,Bad loan risk looms large over Chinese banking sec,"Sep 02, 2012 04:39 PM IST"
184,"Yes Bank, Axis Bank, ICICI Bank top picks: Angel Broking","Aug 29, 2012 09:19 AM IST"
185,PSU banks performance dismal in Q1 FY13: Dolat Cap,"Aug 28, 2012 12:14 PM IST"
186,"Dena Bank, BOB, BOI, PNB report strong growth in Q1FY13","Aug 28, 2012 10:11 AM IST"
187,Poor rains add to bank woes; experts see FY13 NPLs at 4.2%,"Aug 02, 2012 01:00 PM IST"
188,"Week that was: Mute sentiment on earnings, growth concern","Jul 13, 2012 05:52 PM IST"
189,Banks to post 27% YoY growth in PAT for Q1FY13: Dolat,"Jul 10, 2012 02:29 PM IST"
190,Banks margins to come under pressure in 1HFY2013: Angel,"Jul 09, 2012 06:36 PM IST"
191,Banks to see moderate growth this fiscal: Barclays,"Jun 15, 2012 04:45 PM IST"
192,"Dolat Cap picks ICICI Bank, HDFC Bank, Karur Vysya Bank","Jun 14, 2012 11:35 AM IST"
193,"World stocks inch up, capped by Spanish crisis","Jun 13, 2012 01:32 PM IST"
194,"Way2Wealth: Will you buy/sell/hold RIL, Pantaloon, L&T","Jun 07, 2012 09:50 AM IST"
195,"Banking: Sectoral deployment of credit, Emkay","Jun 06, 2012 12:04 PM IST"
196,Good corporate governance key to inclusive growth: Moily,"Jun 06, 2012 10:50 AM IST"
197,"Asian shares recover slightly, but Greece fears remain","May 17, 2012 12:02 PM IST"
198,Spain faces corrosion not collapse from euro crisis,"May 14, 2012 11:42 AM IST"
199,Are the worst of bad loans over for banking industry?,"May 13, 2012 01:13 PM IST"
200,Greece's exit from Eurozone to hit banking sector: F&C,"May 11, 2012 12:40 PM IST"
201,Banking sector: What is the outlook?,"Apr 30, 2012 12:04 PM IST"
202,Spanish debt costs pressure euro,"Apr 17, 2012 01:32 PM IST"
203,Banking sector results preview for Q4FY12: KRChoksey,"Apr 10, 2012 12:24 PM IST"
204,Banking sector results preview for Q4FY12: Angel Broking,"Apr 05, 2012 04:30 PM IST"
205,Expect credit growth for FY12 at 16%: Emkay,"Apr 02, 2012 01:00 PM IST"
206,Here's what to do with these stocks if it's in your kitty,"Mar 24, 2012 01:54 PM IST"
207,Macquarie's 8 reasons for a gloomy outlook on bank shares,"Mar 21, 2012 11:34 AM IST"
208,ICRA Ratings analyses 42 Indian banks,"Mar 02, 2012 11:26 AM IST"
209,Loan growth slowdown to prevail for banks: Emkay,"Mar 01, 2012 01:05 PM IST"
210,SP Tulsian cautious on banking sector,"Feb 02, 2012 05:42 PM IST"
211,"Bank Q3 results: How are experts reading BoB, Union Bank?","Jan 27, 2012 01:39 PM IST"
212,Remuneration norms not so harsh for banks: Emkay,"Jan 16, 2012 01:47 PM IST"
213,Banking sector: What is the outlook?,"Jan 10, 2012 01:04 PM IST"
214,Market to be back to normal in H2 of next yr: Edelweiss Sec,"Dec 21, 2011 02:37 PM IST"
215,Indian banking system continues to display resilience: CARE,"Dec 01, 2011 04:00 PM IST"
216,"See upside in SAIL, Hindalco, ICICI and SBI: MF Global","Dec 01, 2011 10:34 AM IST"
217,"S&P downgrades top US, Europe banks; ups China bank ratings","Nov 30, 2011 04:36 PM IST"
218,"Prefer Axis Bank, ICICI Bank from banking space: Angel","Nov 25, 2011 05:30 PM IST"
219,"Karwa's view on FMCG, banking sectors","Nov 23, 2011 06:55 PM IST"
220,Get Sudarshan Sukhani's technical views on select stocks,"Nov 18, 2011 02:39 PM IST"
221,India's FY13 GDP may come below 7%: BofA ML's Jaipuria,"Nov 14, 2011 12:27 PM IST"
222,"Weekly wrap: Drama at D-Street with Moody's downgrade, IIP","Nov 11, 2011 06:01 PM IST"
223,NPAs won't hit 12% as suggested by Moody's: DK Mittal,"Nov 09, 2011 08:52 PM IST"
224,"Neutral on pharma, positive on pvt banks: Rada Advisors","Nov 09, 2011 02:00 PM IST"
225,Banks' savings account rate deregulation: Dolat Capital,"Oct 31, 2011 06:47 PM IST"
226,Will RBI's Dec promise set mkt mood? Experts say likely,"Oct 25, 2011 01:48 PM IST"
227,JPMorgan cautious on banking but still bets on HDFC. Why?,"Sep 20, 2011 12:27 PM IST"
228,"It's not about stocks anymore, focus on sectors: Dimensions","Sep 19, 2011 08:57 AM IST"
229,"SP Tulsian says forget SBI, look at Dhanlaxmi Bank, DCB","Sep 16, 2011 02:40 PM IST"
230,Indian market will outperform Europe: Clareville Cap,"Sep 13, 2011 05:20 PM IST"
231,"Gold performed better, but equities cheaper: Nilesh Shah","Sep 08, 2011 09:42 AM IST"
232,How much is too much? Legal experts debate new bank norms,"Sep 03, 2011 12:24 PM IST"
233,No problems for globally exposed Indian banks: KV Kamath,"Aug 13, 2011 12:40 PM IST"
234,"World stocks, euro fall on Greek selective default talk","Jul 21, 2011 06:14 PM IST"
235,Align regulatory structure to your biz model: Mah Finance,"Jul 11, 2011 03:48 PM IST"
236,Remain invested in banking sector: Shardul Kulkarni,"Jun 29, 2011 04:41 PM IST"
237,Vora`s view on SBI,"Jun 24, 2011 06:35 PM IST"
238,Religare Cap sees more pain for banks ahead,"May 18, 2011 11:59 AM IST"
239,SBI is still a great stock : Jagdish Malkani,"May 17, 2011 03:01 PM IST"
240,"PSBs on hiring spree,to recruit 45000 personnel in FY12","May 16, 2011 10:22 AM IST"
241,Market unlikely to fall below 5350-5400: Deven Choksey,"May 13, 2011 10:04 AM IST"
242,Jayaram`s view on banking space,"May 11, 2011 05:05 PM IST"
243,"Bank, auto, energy stocks to stabilise market: PN Vijay","May 04, 2011 09:41 AM IST"
244,Banks under pressure; Experts reveal trading tactics,"May 03, 2011 11:10 AM IST"
245,Market to stay volatile if RBI ups rates by 50 bps: Experts,"Apr 29, 2011 05:08 PM IST"
246,RIL needs to start beating expectations: F&C Investments,"Apr 29, 2011 11:58 AM IST"
247,Irani`s view on banking sector,"Apr 25, 2011 07:26 PM IST"
248,"Experts bullish on market, say Nifty may hit 6,000 soon","Apr 25, 2011 04:10 PM IST"
249,PN Vijay sees banks taking market higher; likes HDFC Bank,"Apr 25, 2011 09:59 AM IST"
250,Experts feel banking sector to boost market rally further,"Apr 21, 2011 04:37 PM IST"
251,Dhawan`s view on banking sector,"Apr 11, 2011 06:08 PM IST"
252,Mavani`s view on banking sector,"Apr 01, 2011 06:45 PM IST"
253,Banking sector one of the best economic plays: Nitin Rakesh,"Mar 31, 2011 10:32 AM IST"
254,Kotak`s view on banking sector,"Mar 30, 2011 05:29 PM IST"
255,Seth bullish on banking sector,"Mar 30, 2011 05:09 PM IST"
256,Why does Motilal Oswal see the banking sector flying high?,"Mar 25, 2011 10:52 AM IST"
257,What signals is Anil Manghnani reading from the ADAG pack?,"Mar 21, 2011 11:15 AM IST"
258,Gupta`s view on banking sector,"Mar 18, 2011 05:20 PM IST"
259,Spanish downgrade leaves global markets with knocking knees,"Mar 10, 2011 05:09 PM IST"
260,"Moody's cuts Spain's rating to Aa2, warns of further cuts","Mar 10, 2011 01:57 PM IST"
261,Advani`s view on banking sector,"Mar 01, 2011 07:44 PM IST"
262,What are Sanjeev Prasad's pre-budget bets?,"Feb 25, 2011 12:58 PM IST"
263,Gupta`s view on banking sector,"Feb 22, 2011 06:48 PM IST"
264,Banking sector looks attractive: Doshi,"Feb 17, 2011 06:51 PM IST"
265,Thacker's view on banking sector,"Feb 04, 2011 04:32 PM IST"
266,How do experts review banking space after earnings results?,"Jan 28, 2011 03:17 PM IST"
267,Can a single Eurobond be long-term solution for eurozone?,"Jan 25, 2011 08:29 AM IST"
268,Check out: 3 pvt sector banks Tulsian is bullish on,"Jan 17, 2011 01:48 PM IST"
269,2011: How will the year pan out for banking sector?,"Jan 14, 2011 12:29 PM IST"
270,Maheshwari’s view on banking sector,"Jan 12, 2011 05:24 PM IST"
271,Q3 earnings: How will different sectors fare?,"Jan 11, 2011 03:21 PM IST"
272,Sriram’s view on banking sector,"Jan 10, 2011 05:32 PM IST"
273,Ireland to re-enter debt markets as soon as possible,"Jan 08, 2011 10:29 AM IST"
