,Headlines,Date
369,"PSBs to push co-lending with NBFCs, digital agri financing under Ease 4.0 reform agenda. After April 2020, Bank credit to NBFCs again picks up in February. Axis Bank customers can send money abroad in 100 currencies via mobile app. Penguin sells Yes Bank story rights for film to Almighty Motion Pictures. Kotak Mahindra Bank wants to be challenger in home loan market, maintains low interest rate. Systemic risk in Indian banks to remain high: S&P. RBI penalises Bihar-based co-op bank for KYC violation during exchange of demonetised notes. Bank credit rise 5.56%; deposits 11.4% in FY21. Advances grew 21% year on year while repayment collection efficiency improved: Bandhan Bank. ",2021-04-12
370,"SBI collected Rs 300 crore from zero-balance accounts for certain services in 5 years, reveals study. ",2021-04-11
371,"CRMNEXT Wins the 2021 ""Dream Company to Work For"" Award Presented by Times Ascent and the World HRD Congress. ",2021-04-10
372,"Top Indian bank drags its feet on billionaire Gautam Adani's coal loan. Second wave of COVID infections poses increased risks for fragile economic recovery, banks: Fitch. Airtel Payments Bank announces 'Rewards123' savings account; offers benefits on digital transactions. Mini-lockdown may affect microfinance institutions' collections: Crisil. ",2021-04-09
373,"Even NBFCs face asset quality risks amidst resurgence of COVID-19 infections. We're prepared for whatever happens, says City Union Bank CEO Dr N Kamakodi, of a second coronavirus wave. We've always been a banker for the 'aam aadmi', says City Union Bank CEO Dr N Kamakodi. Covid 2.0 casts a cloud of uncertainty on banks' Q4 numbers. Pay scale for bank CGMs made almost equal to EDs, executives say its against natural justice. ",2021-04-08
374,Banks sanction Rs 15 lakh crore under Mudra Yojana in last 6 years. Decoding RBI's new digital payments moves and their impact on fintech ecosystem. TLTRO finds few takers even as RBI extends deadline. RBI status quo on policy supportive of economic growth; liquidity measures in right direction: Experts. View: Policies that increase competition between banks can improve the lending standards of PSBs. ,2021-04-07
375,"Banks want free vaccine shots for staff. Steel, cement doing very well from banking perspective: Rajkiran Rai G, Union Bank of India. Axis Bank to become co-promoter of Max Life Insurance. RBL Bank targets more SME borrowers after tie-up with UK-based biz solutions provider Tide. ",2021-04-06
376,"CA firms sue RBI after getting replaced as auditors of Allahabad Bank. Yes Bank loans and advances up 0.8% at Rs 1.73 lakh crore by end of Mar 2021; deposits up 55%. HDFC Bank advances up 14 percent, deposits rise 16 percent at the end of March 2021. ICRA warns of significant jump in bad loans in current fiscal year. Federal Bank gross advances up by 9% at Rs 1.35 lakh crore by March 2021, deposits up 13%. Gross NPAs of banks may rise to 9.6-9.7% by March-end: Report. Latest round of Covid restrictions has lenders fretting over rising defaults. Banks report modest growth in advances and deposits in the last quarter of FY 2020-21. J.P. Morgan ties up with BillDesk for online payments partnership. RBI withdraws restrictions on Youth Development Co-operative Bank. Investment banking fees plunge 34 pc in Q1 to USD 194.5 mn: Report. PSU Banks fully transmit rate cuts on fresh loans. ",2021-04-05
377,"India's public banks may have to take Rs 2,000 crore hit after SC order on interest waiver. SCDCC bank achieves record profit of Rs 33.65 crore. SBI Card sees over 50 percent of its transaction from online payments, says CEO. Year-end pressure hits fund transfers via IMPS, UPI in millions. Banks sanctions Rs 25,586 cr to 1.14 lakh Stand-Up India accounts in 5 years. ",2021-04-04
378,"PSU banks go slow on asset sales, await privatisation list. Covid-19 surge derails banks’ plans to get back to HQs. ",2021-04-03
379,"RBI may continue its curbs on HDFC Bank following technical glitches. PNB plans to hire non-judicial member to scrutinise proposals on compromise, write off. Karnataka Bank targets over Rs 1.42 lakh cr business turnover in FY22; says digital the way forward. ",2021-04-02
380,"ICICI Bank, PhonePe tie up for issuance of FASTags. Bank credit to grow 10% in FY22 on faster GDP expansion, policy measures: Crisil. Loans to mid-size Indian firms up most in a decade on cash surge. State Bank of India customers face network glitches for online transactions. Yes Bank loan fraud: ED files charge sheet against Mumbai realty firm owners, others. India Inc's credit quality improves sharply in H2FY21, likely to sustain. HDFC increases FD rates up to 25 bps. ",2021-04-01
381,"SBI signs loan agreement of $1 billion with JBIC, taking total facility to $2 billion. India to inject $2 billion capital in four weakened state banks. HDFC Ltd increases rates on fixed deposits maturing between 33 and 99 months by 10-25 basis. ",2021-03-31
382,Piramal may sell developer loans of DHFL after deal. Loan moratorium: Lenders want compensation for interest loss. HDFC Bank faces intermittent glitches with payments platform. Punjab & Sind Bank declares loans worth Rs 150 cr to IL&FS Transportation as fraud. Rising Covid cases could derail financial sector recovery. Automatic recurring payment to comply with RBI direction from April 1. ,2021-03-30
383,Govt unlikely to continue with zero-coupon bond route to recap PSU banks. Banks to conduct special clearing operations for closure of government accounts on March 31. Government not inclined to bear loan moratorium costs. ,2021-03-28
384,RBI says engaged with prospective investors to secure best terms for PMC Bank depositors. ,2021-03-26
385,"Tata Sons readying ‘universal’ payments solution. ""Be humble and honest above all else,"" HDFC Bank boss pens a letter to employees. Mumbai: PMC account holders stage protest in Bhandup. View: Good mandate, unintended repercussions. Ensuring health of banking sector top priority: Shaktikanta Das at India Economic Conclave 2021. Parliament passes bill to set up National Bank for Financing Infrastructure and Development. India will have heterogeneous banking sector in a decade with four types of banks: Shaktikanta Das. Bank of Maharashtra add six more branches. Punjab & Sind Bank declares IL&FS account as fraud with Rs 399 crore outstanding. ",2021-03-25
386,"Removal of bad debt ‘hangover’ hands Indian banks clarity. Can Fin Homes' CEO has aggressive growth plans for next couple of years. Govt may seek details of interest on interest charged by banks. Privatising two PSBs: India Ratings warns of rating impact if govt cedes control. ICICI Bank enables customers to break high-value transactions into EMIs. Sebi orders attachment of bank, demat, MF accounts of Rana Kapoor. NBFCs want govt to refund interest on deposits. Former RBI deputy governor Khan not seeking re-appointment on Bandhan Bank board. SC verdict on compound interest/penalty refund not to impact banks as govt to reimburse: Yes Securities. ",2021-03-24
387,"SBI invokes personal guarantees given by KSK Energy promoters. No compound or penal interest be charged from borrowers during moratorium period, directs SC. Interest waiver not possible, can't allow extension of loan moratorium period, says SC. SC order a big relief, removes uncertainties: Bankers. Supreme Court pronounces verdict on plea seeking extension of loan moratorium. Sense has prevailed, moratorium is a commercial decision that banks should take: Uday Kotak. DK Mittal has two suggestions for RBI to improve banking sector. Banks' NPAs declined to Rs 5.70 lakh crore at December-end: Anurag Singh Thakur. Bankers welcome SC order but brace for hit on reversal of interest. Bad loans likely to jump by Rs 1.3 lakh crore. ",2021-03-23
388,"After reaching pre-Covid levels, we will now focus on surpassing industry growth: SBI Cards Boss. Business activities gradually improving but it could still be a while before MFI segment sees a turnaround. ",2021-03-22
389,"Post exit from PCA framework, IDBI Bank to focus on improving efficiency ratios, says MD. ",2021-03-21
390,View: The issues with RBI's plan to set up 'NUE' entity for retail payments. ,2021-03-20
391,Federal Bank plans to buy microfinance company to expand business. Our digital transactions have gone as high as 67% now: SBI Chairman. Gold loan offtake slows in Q4 as price comes down. Bandhan Bank inducts two new members on its board. ,2021-03-19
392,Big opportunity for investing in India’s private credit market: Experts. Banks may go slow on gold loans. ,2021-03-18
393,"Infra, farm reforms put India on $5-trillion track: Aditya Puri, former chief executive of HDFC Bank. We had a vision that we will be a world class Indian bank: Aditya Puri. NPAs expected to increase in first half of 2021: FICCI-IBA survey. See business normalisation in 90 days: HDFC Bank retail head. HDFC Bank leads peer lenders over mobile transactions despite tech glitches. ",2021-03-17
394,"CRR-SLR relief a must to look at HDFC-HDFC bank merger: Keki Mistry, CEO, HDFC. HDFC is seen not just as a mortgage company but as a financial conglomerate: Keki Mistry, CEO, HDFC. Bank strike Day 2: Services that are likely to be disrupted today. Bank employees continue nationwide strike for 2nd consecutive day. Banking services in Maharashtra impacted on second day of nationwide strike. According to a December 2020 RBI survey, banks witnessed high demand for individual loans. Permission for new pvt banks to participate in govt biz will be based on RBI guidelines: FM. Performance of unsecured loans worsening, says India Ratings. Bank of Baroda bets on new digital platform to expand retail lending. Bank union strike severely disrupts banking services across the country. IFSCA allows banks in IFSCs to undertake portfolio management, investment advisory services. Reserve Bank imposes Rs 2 cr penalty on SBI. SBI, Paytm Payments Bank, PhonePe lead in UPI transactions in Feb. ",2021-03-16
395,"Perpetual bond issue may hit PSB fundraising plans. Nationwide strike impacts banking services of PSU banks on day one. Bank Privatisation: PSB employees on a two-day nationwide strike against the proposed measure. Banking services in Maharashtra hit as 40,000 bank employees, officers join two-day strike. India’s banks are on strike, here’s all the services affected today and tomorrow. Services of PSBs hit in Bengal as bank unions go on strike to protest against privatisation. Banking services impacted across Maharashtra on first day of strike. RBI asks banks to implement image-based Cheque Truncation System in all branches by September 30. ",2021-03-15
396,"Bank lending 50 per cent higher in October-February. Bank operations may be hit on Monday, Tuesday due to nationwide unions' strike. Bank lending 50 per cent higher in October-February. ",2021-03-14
397,Community-focused banks face existential crises over a lack of capital cushion and inadequate oversight. ,2021-03-13
398,"RBI is exploring ways to regulate online loan apps. To capitalise on India, you must be entrenched, says Piyush Gupta of DBS Bank. India’s bank employees are striking on March 15 and 16. Here’s what we know. Videocon ex-promoter Venugopal Dhoot granted bail in ICICI Bank-Chanda Kochhar case. Indian Overseas Bank gets new executive director. FinMin to infuse Rs 14,500 cr in banks under RBI's prompt corrective action framework soon. HDFC Bank to cover vaccination cost of employees, family members. Ishraq Ali Khan takes charge as UCO Bank's executive director. Indian banks' loans rose 6.6% y/y in two weeks to Feb 26: Central Bank. ",2021-03-12
399,"Executives get longer stint at top deck of PSU banks. Cholamandalam, Karur Vysya Bank come together for co-lending business. HSBC banks on NRI, wealth management in fresh retail charge. MNCs are prepaying rupee borrowings and sourcing money from their home bases: Taranjit Jaswal, Barclays Bank India. Banks unions call for two-day strike against proposed privatisation of PSBs. SBI to conduct e-auctions of 12 bad accounts this month. ",2021-03-11
400,"KKR-led group weighs Rs 1,100 crore out-of-court offer from Sintex promoters. ICICI Bank to bear cost of COVID-19 vaccination for employees. SC sets up committee, seeks report on steps to be taken for early disposal of cheque bounce cases. RBI removes PCA restrictions on IDBI Bank. Erstwhile Syndicate Bank cheque books valid till June-end. Uco Bank gets a new executive director after a year. Axis Bank launches contactless wearable payment devices. Cyber security critical for digital banking success: SBI official. ",2021-03-10
401,"Lenders cut exposure to lower rated developers, improve credit profile. Banks sanction Rs 2.46 lakh cr to 92 lakh borrowers under credit guarantee scheme to MSMEs. ",2021-03-09
402,"Large Indian lenders seek time on standing instructions. Central banks in no rush to raise rates, will back growth: Shaktikanta Das. Citigroup needs a new strategy for its lagging Asian consumer banks. Fraudulent loans cannot be sold to bad bank: RBI. Economic impact of COVID-19 to weigh on asset quality of banks in FY'22: Fitch. More than 50% account holders under PMJDY women: FinMin. BBB to select MD, DMDs of proposed development financial institution. Yes Bank launches 'Yes Essence' services for women. Kotak Mahindra Bank says glitch in its accounts due to wrong claims by a PSU bank. Bombay HC directs Williamson Magor to deposit Rs 15 crore in the court in a suit filed by Kotak Bank. Banks write-off Rs 1.15 lakh crore in 9 months of FY21: Anurag Singh Thakur. ",2021-03-08
403,"Flushed with liquidity, banks slash home loan rates to decadal low. Data sharing, cybersecurity top concern areas for banks, customers: Deloitte. ",2021-03-07
404,"Indian Bank reports 3 NPA accounts as fraud to RBI. Bad bank is a great initiative but can turn into an accounting gimmick unless foreign investors are brought in: K Balasubramanian, Citibank India. Banks may seek extension of freeze on NCLT proceedings. Kotak Mahindra Bank divests 10 per cent stake in ECA Trading Services to its arm. Kotak Mahindra Bank appoints agricultural economist Ashok Gulati as additional director. ",2021-03-05
405,"Banking services may get affected later this month due to proposed strike: Canara Bank. Indian state-run banks likely to see moderate bad loan additions: Morgan Stanley. J&K govt withdraws nomination of Zubair Iqbal as MD of J&K Bank. India Ratings flags systemic risk issues on banking exposure to NBFCs. Bank of Baroda petitions Delhi HC to vacate stay on Reliance Home asset sale. More women borrowed personal loans in pandemic: Report. ICICI, HDFC, SBI will have to offload Rs 1.2 lakh cr if RBI caps stake in insurance arms: Report. Kotak Mahindra Bank to handle salary account of Indian army personnel. ICICI Bank targeting to serve 20 lakh customers of rival banks through app. ",2021-03-04
406,"RBI raises concerns over money-laundering checks. Extreme weather like floods, droughts, cyclones puts $84 billion of Indian banks debt at risk. SBI Card customers can now make transactions on Jio Pay platform. Ujjivan Small Finance Bank's micro loan collection in Assam suffers following loan waiver promise. Axis Bank partners WhatsApp to offer basic banking services. HDFC follows SBI, Kotak, cuts home loan rate. NBFCs push for parity with banks, seek access to credit repository of large borrowers. ",2021-03-03
407,SBI led webinar on Indian budget evokes favourable response in Israel. RBI restricting banks from raising stakes in insurance firms - sources. Capital infusion: Punjab & Sind Bank to convene EGM this month to seek shareholders' nod. ,2021-03-02
408,"Nine banks, two non-bank lenders to infuse Rs 7,000 crore in bad bank. Canara Bank's Executive Director Matam Venkata Rao appointed as new MD & CEO of Central Bank. State Bank of India (SBI) cuts home loan interest rates, offer ending on 31 March. HDFC Bank faces intermittent downtime on Payments stack. IDBI Bank to set off Rs 45,586-cr accumulated losses against balance in securities premium account. Bank credit grows to 6.58 per cent, deposits at 11.75 per cent. Kotak Mahindra Bank cuts home loan rates to 6.65%. ",2021-03-01
409,SBI eyes aircraft leasing business. View: How the government can truly make India's state-run banks efficient just like their private sector peers. ,2021-02-28
410,Axis Bank board approves reclassification of United India Insurance as public shareholder. ,2021-02-27
411,"Bad bank will be a new ARC set up by PSBs: Shaktikanta Das. Wipro employees had a role in Citibank's big blunder that saw $900 million gone. Government committed to strengthen banking sector: PM Narendra Modi. Regulating the financial sector - a challenge for the sector, but must for consumer confidence. For digital payments, the battle isn't for space but to get merchants online. IOB signs corporate agency pact with SBI General Insurance. Banking sector was hurt in the name of aggressive lending a decade back: PM Modi. ",2021-02-26
412,"IBA starts identifying stressed loans for proposed bad bank. India has space for another strong ARC led by banks: Shaktikanta Das. Upbeat on rural prospects, DCB Bank focuses on tractor loans. ",2021-02-25
413,Improvement in macroeconomic conditions to alleviate banking sector stress: S&P. Bankers fear spike in NPAs from Mudra loans. Fino Payments Bank says inclusion in commercial bank list to boost business prospects. Bank privatisation: How should India go about it?. ,2021-02-24
414,"All MPC members batted for accommodative policy stance. Federal Bank aims 'mid-teen' growth in credit for FY22. HSBC's India PBT in 2020 inches up to $1.024 billion. Paytm Payments Bank helps 2.6 lakh FASTag users get back wrongly deducted toll charges. CSB Bank strengthens senior leadership, aims for 30% growth. ",2021-02-23
415,"Transferring sticky loans: Fully provided NPAs may go to proposed bad bank. Stress in retail loans of banks may triple by FY22 end: Ind-Ra. 10 months on, appointment of J&K Bank chief hangs in limbo. SBI joins JPMorgan's blockchain-based payment network. ",2021-02-22
416,"Team of diverse investors puts in bid for embattled PMC Bank. Deccan Urban Co-op Bank: RBI puts Rs 1,000 withdrawal cap for 6 months. Corporate lenders vs taxman: Round one of bankruptcy bout goes to the lenders. ",2021-02-20
417,"Govt flags SBI-HDFC Bank-Bank of Baroda's NUE plan to rival NPCI. Indian Bank signs MOU with SID of IISc, for funding Start-ups and MSMEs. Bank unions stage protest against privatisation; plan to march towards Parliament in March. LIC Housing Finance disburses Rs 1,331 crore of loans via mobile app. Karnataka Bank reports Rs 34.16-crore fraud to RBI. RBI puts Rs 1,000 withdrawal cap on Deccan Urban Co-operative Bank; fresh loans, deposits restricted. ",2021-02-19
418,"KKR India NBFC, InCred set for all-stock merger. As court rules Citi can't get back $500 mn it wrongly paid, what does India's law say. Government's initiatives brings back loan growth to pre-Covid levels. RBI tightens payments security norms for banks, digital payment operators. ",2021-02-18
419,Public sector banks plan ‘daylight overdrafts’ to lure top companies from private rivals. ,2021-02-17
420,"Banks eye bigger home loan pie as housing finance companies face challenges. RBI permits residents to make remittances to IFSCs under LRS. DFIs to play important role in infrastructure funding: HDFC Bank's Rakesh Singh. RBI issues draft guidelines for CDS, derivative contracts. ",2021-02-16
421,"Top NBFCs seek a glide path for switch to banking avatar. Kotak Mahindra Bank announces launch of Kotak Remit on mobile. RBI sets up panel to suggest steps for strengthening, consolidating urban co-operative banks. Future of banking is a digital business model. India shortlists four banks for potential privatisation: Sources. Indian Bank integrates core banking software of erstwhile Allahabad Bank. ",2021-02-15
422,"Former SBI chief Rajnish Kumar to be exclusive advisor for Kotak Group's USD 1 billion-stressed assets fund. Debt knell: With retail debt past Rs 40 lakh crore, worries about defaults on repayments rise. ",2021-02-13
423,"PMLA case: Ex-ICICI CEO Chanda Kochhar appears before court. Bank privatisation debate: Here's how the doyens see it. Some points to remember while sending money from one country to another. PMLA case: Ex-ICICI Bank CEO Chanda Kochhar granted bail. CREDAI, IPPB ink pact to open bank accounts for construction workers. PMLA case: Former ICICI Bank CEO Chanda Kochhar gets bail. ",2021-02-12
424,India’s recovery reduces risk of a plunge in banks’ asset quality: Moody’s. Here's how you can avoid premature withdrawals from your bank fixed deposits. Microfinance sector shrinks by 4% in the nine-month period. Indian Bank says customers may face service disruptions this weekend due to software migration. View: India's plan to set up a bad bank to resolve NPA crisis is riddled with problems. ,2021-02-11
425,"HDFC Bank beats SBI in Covid-19 scheme loans. Yes Bank CEO says foreign firms keen to invest in proposed asset reconstruction arm. SBI crosses Rs 5 trillion-mark in home loan business. RBI restricts withdrawals from Independence Co-operative Bank, Nashik. SBI looking to double home loan portfolio to Rs 10 lakh crore in next five years: Chairman. Revamped Gold Scheme: Minimum deposit cut to 10 gm, jewellers roped in. ",2021-02-10
426,"Bad bank could help PSBs focus on growth, say experts. Banks unions call for two-day strike against proposed privatisation of PSBs. RBI seeks details of Punjab National Bank's capital raising plans. ",2021-02-09
427,"Capital support for Indian govt banks to determine loan growth: Fitch. Top 100 wilful defaulters owe lenders Rs 84,632 crore. Service complaints by bank customers rise 57 pc to over 3 lakh: RBI report. ",2021-02-08
428,"View: Sell the best public sector banks; bids can be foreign. PNB expects Rs 3,800 cr recovery from Bhushan Power resolution; sees good amount from DHFL too. ",2021-02-07
429,"RBI MPC meet: Normalising CRR won’t crunch cash. View: To address India’s credit scarcity problem, allow corporate houses to set up banks. Nabard disburses Rs 16,500 crore under RIDF in first 10 months of FY21. PNB MD Mallikarjuna Rao on setting up of a Bad Bank. ",2021-02-06
430,"RBI announces major structural move, gives retail investors direct online access to securities market. Will transfer Rs 2.2 lakh crore NPAs to ‘bad bank’: Financial services secretary. ICICI Bank, MUFG Bank tie up for serving Japanese corporations operating in India. All remaining 18,000 bank branches to be under CTS by Sep: RBI. Three offers received for PMC Bank resolution, says RBI Governor Shaktikanta Das. A deep dive being done to find out true state of NPAs. Risks of bad loans recede even in a slowdown, NPLs are lesser than expected: Moody's. Bankers expect few takers for RBI's new TLTRO tap for shadow banks. ",2021-02-05
431,"UPI records 2.3 billion transactions worth Rs 4.2 trillion in January 2021: NITI Aayog CEO. Chanda Kochhar looks to have misused post: PMLA court. Millions of defaults threaten microfinance's future in India. Banks wrote off Rs 62,000 cr loans of top 100 wilful defaulters as of March 20: RBI tells RTI activist. Finance Minister allows Andhra to borrow additional Rs 1,515 crore for undertaking power sector reforms. ",2021-02-04
432,RBI imposes Rs 55 lakh penalty on Pune-based Seva Vikas Cooperative Bank. ,2021-02-03
433,"Budget 2021: Big reform push in banking, insurance. Why Budget proposal for setting up of a bad bank is a good idea. RBI appoints external firm to audit HDFC Bank's IT infra in view of service outages. Banks' NPAs decline to Rs 8.08 lakh crore in September 2020 from Rs 10.36 lakh crore in March 2018: Govt. 3 PSU banks likely to be out of PCA framework by March: DFS Secretary. ",2021-02-02
434,"FM allocates Rs 20,000 crore for bank recapitalisation, proposes AMC-ARC for NPAs. Govt proposes Rs 20,000-cr recapitalisation for PSBs in 2021-22. Budget 2021-2022: Bad Bank for large corporates and a new framework for MSMEs. Budget relief: Depositors of stressed banks can access up to Rs 5 lakh of deposits. Budget: Capital infusion in public sector banks undershoots market expectations. Govt lowers loan limit for debt recovery for NBFCs with Rs 100cr asset size. Bank credit grows by 6.36%, deposits by 11.41%. ",2021-02-01
435,CEA Subramanian pitches for private sector-led bad bank to deal with NPAs. Covid Impact: Banks might be staring at a spike in retail NPAs. ,2021-01-31
436,"IBC has changed debtor-creditor dynamics. Rama Mohan Rao Amara takes charge as new MD & CEO of SBI Card. PMLA case: Kochhars, Venugopal Dhoot told to appear in court on February 12. ",2021-01-30
437,"Economic Survey points out the original sin that caused India's banking crisis. Digital transactions of over Rs 4 lakh cr done through UPI in Dec 2020: President. CBI books six Indian Overseas Bank officials for misappropriating Rs 4.56 crore. YES Bank, LVB events show RBI did not identify 'evergreening', shows Eco Survey. RBI cancels licence of Kolhapur-based Shivam Sahakari Bank. ",2021-01-29
438,Bank of Baroda first public sector bank to look at permanent work-from-home option. Axis Bank to treat home loans of credit card defaulters as NPAs. SBI asset quality remains healthy: Chairman Khara. Swaminathan J and Ashwini Kumar Tewari take charge as SBI MDs. Competition Commission dismisses complaint against ICICI Bank. ,2021-01-28
439,"BoB CEO warns about stress in retail, SME loans; QIP likely this qtr. No change in CRISIL rating grades for banks: RBI. SBI Card MD and CEO Tewari resigns; appointed as SBI MD. ",2021-01-27
440,"Yes Bank better placed on bad loans, but has miles to go. Banks review services policy for WhatsApp. ",2021-01-26
